"qid","Len","P31","P50","P356","P921","P1476"
"","A framework for the use of artificial neural networks for water treatment: development and application","Q13442814","('Pierre Bérubé',)","10.2166/ws.2020.205","water treatment","A framework for the use of artificial neural networks for water treatment: development and application"
"","A model for analyzing water reuse and resource recovery potential in urban areas","Q13442814","('Pierre Bérubé',)","10.1139/l2012-109","water","A model for analyzing water reuse and resource recovery potential in urban areas"
"","Ageing of membranes for water treatment: Linking changes to performance","Q13442814","('Pierre Bérubé',)","10.1016/j.memsci.2015.12.033","water treatment","Ageing of membranes for water treatment: Linking changes to performance"
"","Air sparging for fouling control","Q13442814","('Pierre Bérubé',)","10.1016/b978-0-12-819809-4.00011-5","","Air sparging for fouling control"
"","Application of the electrodiffusion method to measure wall shear stress: integrating theory and practice","Q13442814","('Pierre Bérubé',)","10.1002/ceat.201400026","","Application of the electrodiffusion method to measure wall shear stress: integrating theory and practice"
"","Assessing the effects of sodium hypochlorite exposure on the characteristics of PVDF based membranes","Q13442814","('Pierre Bérubé',)","10.1016/j.watres.2013.06.018","membranes","Assessing the effects of sodium hypochlorite exposure on the characteristics of PVDF based membranes"
"","Assessment of mass transfer coefficients in coalescing slug flow in vertical pipes and applications to tubular airlift membrane bioreactors","Q13442814","('Pierre Bérubé',)","10.1016/j.ces.2010.12.034","industrial and manufacturing engineering","Assessment of mass transfer coefficients in coalescing slug flow in vertical pipes and applications to tubular airlift membrane bioreactors"
"","Biological Ion Exchange capable of sulphate-based secondary ion exchange during long-term DOC removal","Q13442814","('Pierre Bérubé',)","10.1016/j.watres.2021.117036","ion exchange","Biological Ion Exchange capable of sulphate-based secondary ion exchange during long-term DOC removal"
"","Biological ion exchange as an alternative to biological activated carbon for drinking water treatment","Q13442814","('Pierre Bérubé',)","10.1016/j.watres.2019.115148","drinking water","Biological ion exchange as an alternative to biological activated carbon for drinking water treatment"
"","Biologically active ion exchange (BIEX) for NOM removal and membrane fouling prevention","Q13442814","('Pierre Bérubé',)","10.2166/ws.2017.016","ion exchange","Biologically active ion exchange (BIEX) for NOM removal and membrane fouling prevention"
"","Book Review: Safe Drinking Water: Lessons from Recent Outbreaks in Affluent Nations","Q13442814","('Pierre Bérubé',)","10.1139/s05-001","drinking water","Book Review: Safe Drinking Water: Lessons from Recent Outbreaks in Affluent Nations"
"","Characteristics of natural organic matter and formation of chlorinated disinfection by-products from two source waters that respond differently to ozonation","Q13442814","('Pierre Bérubé',)","10.1080/01919510802169272","water","Characteristics of natural organic matter and formation of chlorinated disinfection by-products from two source waters that respond differently to ozonation"
"","Characterization and modelling of soluble microbial products in activated sludge systems treating municipal wastewater with special emphasis on temperature effect","Q13442814","('Pierre Bérubé',)","10.1016/j.scitotenv.2021.146471","water","Characterization and modelling of soluble microbial products in activated sludge systems treating municipal wastewater with special emphasis on temperature effect"
"","Characterization of Shear Forces Inside Gas-Sparged Hollow Fiber Membrane Modules","Q13442814","('Pierre Bérubé',)","10.1016/j.memsci.2007.03.032","","Characterization of Shear Forces Inside Gas-Sparged Hollow Fiber Membrane Modules"
"","Characterization of anionic surfactant-induced toxicity in a primary effluent","Q13442814","('Pierre Bérubé',)","10.1139/s07-036","environmental engineering","Characterization of anionic surfactant-induced toxicity in a primary effluent"
"","Characterization of fouling of tertiary membranes","Q13442814","('Pierre Bérubé',)","10.2175/193864718825138132","membranes","Characterization of fouling of tertiary membranes"
"","Characterization of performance of full-scale tertiary membranes under stressed operating conditions","Q13442814","('Pierre Bérubé',)","10.2166/wst.2020.140","membranes","Characterization of performance of full-scale tertiary membranes under stressed operating conditions"
"","Coagulation optimization for DOC removal: pilot-scale analysis of UF fouling and disinfection byproduct formation potential","Q13442814","('Pierre Bérubé',)","10.2166/ws.2015.157","water","Coagulation optimization for DOC removal: pilot-scale analysis of UF fouling and disinfection byproduct formation potential"
"","Coagulation/flocculation prior to low pressure membranes in drinking water treatment: a review","Q13442814","('Pierre Bérubé',)","10.1039/d0ew00461h","drinking water","Coagulation/flocculation prior to low pressure membranes in drinking water treatment: a review"
"","Committee report: recent advances and research needs in membrane fouling","Q13442814","('Pierre Bérubé',)","10.1002/j.1551-8833.2005.tb07452.x","","Committee report: recent advances and research needs in membrane fouling"
"","Contribution of biofilm layer to virus removal in gravity-driven membrane systems with passive fouling control","Q13442814","('Pierre Bérubé',)","10.1016/j.seppur.2020.117336","filtration and separation","Contribution of biofilm layer to virus removal in gravity-driven membrane systems with passive fouling control"
"","Development of a membrane resistance based modeling framework for comparison of ultrafiltration processes","Q13442814","('Pierre Bérubé',)","10.33915/etd.2325","modeling","Development of a membrane resistance based modeling framework for comparison of ultrafiltration processes"
"","Distribution of surface shear forces and bubble characteristics in full-scale gas sparged submerged hollow fiber membrane modules","Q13442814","('Pierre Bérubé',)","10.1016/j.desal.2011.07.050","","Distribution of surface shear forces and bubble characteristics in full-scale gas sparged submerged hollow fiber membrane modules"
"","Distribution of surface shear stress for a densely packed submerged hollow fiber membrane system","Q13442814","('Pierre Bérubé',)","10.1016/j.desal.2014.11.014","","Distribution of surface shear stress for a densely packed submerged hollow fiber membrane system"
"","EXPERIMENTAL MEASUREMENTS OF SHEAR STRESS IN A TUBULAR AIR LIFT MEMBRANE SYSTEM","Q13442814","('Pierre Bérubé',)","10.2166/wst.2011.521","environmental engineering","EXPERIMENTAL MEASUREMENTS OF SHEAR STRESS IN A TUBULAR AIR LIFT MEMBRANE SYSTEM"
"","Effects of elevated operating temperatures on methanol removal kinetics from synthetic kraft pulp mill condensate using a membrane bioreactor","Q13442814","('Pierre Bérubé',)","10.1016/s0043-1354(00)00203-7","","Effects of elevated operating temperatures on methanol removal kinetics from synthetic kraft pulp mill condensate using a membrane bioreactor"
"","Effects of kraft evaporator condensate matrix on methanol removal in a high temperature membrane bioreactor","Q13442814","('Pierre Bérubé',)","10.1016/s0273-1223(99)00735-0","","Effects of kraft evaporator condensate matrix on methanol removal in a high temperature membrane bioreactor"
"","Energy consumption related to shear stress for membrane bioreactors used for wastewater treatment","Q13442814","('Pierre Bérubé',)","10.2478/v10173-012-0012-1","water treatment","Energy consumption related to shear stress for membrane bioreactors used for wastewater treatment"
"","Erratum to¿ The effect of hydrodynamic conditions and system configurations on the permeate flux in a submerged hollow fiber membrane system¿[J. Membr. Sci. 271 (2006) 29¿ 37]","Q13442814","('Pierre Bérubé',)","10.1016/j.memsci.2006.01.048","physical and theoretical chemistry","Erratum to¿ The effect of hydrodynamic conditions and system configurations on the permeate flux in a submerged hollow fiber membrane system¿[J. Membr. Sci. 271 (2006) 29¿ 37]"
"","Euromembrane Conference 2012 [P3. 089] Efficient gas sparging design through characterising the hydrodynamics inside submerged HF membrane systems","Q13442814","('Pierre Bérubé',)","10.1016/j.proeng.2012.08.985","","Euromembrane Conference 2012 [P3. 089] Efficient gas sparging design through characterising the hydrodynamics inside submerged HF membrane systems"
"","Evaluation of adsorption and coagulation as membrane pretreatment steps for the removal of organic material and disinfection-by-product precursors","Q13442814","('Pierre Bérubé',)","10.1139/s02-035","environmental engineering","Evaluation of adsorption and coagulation as membrane pretreatment steps for the removal of organic material and disinfection-by-product precursors"
"","Experimental study and CFD modelling of a two-phase slug flow for an airlift tubular membrane","Q13442814","('Pierre Bérubé',)","10.1016/j.ces.2009.04.048","industrial and manufacturing engineering","Experimental study and CFD modelling of a two-phase slug flow for an airlift tubular membrane"
"","Experimental validation of a hydrodynamic CFD model of a hollow fiber MBR using shear intensity measurements","Q13442814","('Pierre Bérubé',)","10.2175/193864710798217151","","Experimental validation of a hydrodynamic CFD model of a hollow fiber MBR using shear intensity measurements"
"","Filtration and cleaning performances of PVDF membranes aged with exposure to sodium hypochlorite","Q13442814","('Pierre Bérubé',)","10.1016/j.seppur.2017.12.004","membranes","Filtration and cleaning performances of PVDF membranes aged with exposure to sodium hypochlorite"
"","Fouling in air sparged submerged hollow fiber membranes at sub-and super-critical flux conditions","Q13442814","('Pierre Bérubé',)","10.1016/j.memsci.2007.09.039","membranes","Fouling in air sparged submerged hollow fiber membranes at sub-and super-critical flux conditions"
"","Hybrid membrane processes using activated carbon treatment for drinking water: a review","Q13442814","('Pierre Bérubé',)","10.1016/j.memsci.2012.04.012","drinking water","Hybrid membrane processes using activated carbon treatment for drinking water: a review"
"","Impact of low coagulant dosages on protein fouling of ultrafiltration membranes","Q13442814","('Pierre Bérubé',)","10.1016/j.jwpe.2019.100801","membranes","Impact of low coagulant dosages on protein fouling of ultrafiltration membranes"
"","Impact of pac fines in fouling of polymeric and ceramic low-pressure membranes for drinking water treatment","Q13442814","('Pierre Bérubé',)","10.3390/membranes6030038","drinking water","Impact of pac fines in fouling of polymeric and ceramic low-pressure membranes for drinking water treatment"
"","Integrated oxidation membrane filtration process–NOM rejection and membrane fouling","Q13442814","('Pierre Bérubé',)","10.1016/j.watres.2016.08.024","ecological modelling","Integrated oxidation membrane filtration process–NOM rejection and membrane fouling"
"","Investigation of the effect of viscosity on slug flow in airlift tubular membranes in search of a sludge surrogate","Q13442814","('Pierre Bérubé',)","10.2166/wst.2010.118","membranes","Investigation of the effect of viscosity on slug flow in airlift tubular membranes in search of a sludge surrogate"
"","Long-term performance of biological ion exchange for the removal of natural organic matter and ammonia from surface waters","Q13442814","('Pierre Bérubé',)","10.1016/j.watres.2018.07.057","water","Long-term performance of biological ion exchange for the removal of natural organic matter and ammonia from surface waters"
"","Measurement of reduced sulphur compounds contained in aqueous matrices by direct injection into a gas chromatograph with a flame photometric detector","Q13442814","('Pierre Bérubé',)","10.1016/s0021-9673(98)00882-6","","Measurement of reduced sulphur compounds contained in aqueous matrices by direct injection into a gas chromatograph with a flame photometric detector"
"","Mechanisms Governing the Permeate Flux in an Anaerobic Membrane Bioreactor Treating Low-Strength/Municipal Wastewaters: A Literature Review","Q13442814","('Pierre Bérubé',)","10.2175/106143005x72858","water","Mechanisms Governing the Permeate Flux in an Anaerobic Membrane Bioreactor Treating Low-Strength/Municipal Wastewaters: A Literature Review"
"","Membrane ageing in full-scale water treatment plants","Q13442814","('Pierre Bérubé',)","10.1016/j.watres.2019.115212","water treatment","Membrane ageing in full-scale water treatment plants"
"","Membrane bioreactors for anaerobic treatment of wastewaters: phase II","Q13442814","('Pierre Bérubé',)","10.2166/9781780403946","water","Membrane bioreactors for anaerobic treatment of wastewaters: phase II"
"","Membrane bioreactors: Theory and applications to wastewater reuse","Q13442814","('Pierre Bérubé',)","10.1016/s1871-2711(09)00209-8","water","Membrane bioreactors: Theory and applications to wastewater reuse"
"","Membrane fouling mechanisms of a membrane enhanced biological phosphorus removal process","Q13442814","('Pierre Bérubé',)","10.1016/j.memsci.2007.03.019","physical and theoretical chemistry","Membrane fouling mechanisms of a membrane enhanced biological phosphorus removal process"
"","Messung von Schubspannungen beim Aufstieg von Einzelblasen","Q13442814","('Pierre Bérubé',)","10.1002/cite.201050247","industrial and manufacturing engineering","Messung von Schubspannungen beim Aufstieg von Einzelblasen"
"","Model development to access the ageing of polymeric membranes due to chemical cleaning","Q13442814","('Pierre Bérubé',)","10.1016/j.proeng.2012.08.605","membranes","Model development to access the ageing of polymeric membranes due to chemical cleaning"
"","Modeling the impact of permeate flux and hydrodynamic conditions on fouling in submerged hollow fiber membranes","Q13442814","('Pierre Bérubé',)","10.2166/ws.2007.139","membranes","Modeling the impact of permeate flux and hydrodynamic conditions on fouling in submerged hollow fiber membranes"
"","Nanofiltration and Tight Ultrafiltration Membranes for Natural Organic Matter Removal—Contribution of Fouling and Concentration Polarization to Filtration Resistance","Q13442814","('Pierre Bérubé',)","10.3390/membranes7030034","membranes","Nanofiltration and Tight Ultrafiltration Membranes for Natural Organic Matter Removal—Contribution of Fouling and Concentration Polarization to Filtration Resistance"
"","Numerical and experimental investigation of pulse bubble aeration with high packing density hollow-fibre MBRs","Q13442814","('Pierre Bérubé',)","10.1016/j.watres.2019.05.056","ecological modelling","Numerical and experimental investigation of pulse bubble aeration with high packing density hollow-fibre MBRs"
"","Operation of passive membrane systems for drinking water treatment","Q13442814","('Pierre Bérubé',)","10.1016/j.watres.2017.02.065","drinking water","Operation of passive membrane systems for drinking water treatment"
"","Optimal Module Configuration and Sparging Scenario for a Submerged Hollow Fiber Membrane System","Q13442814","('Pierre Bérubé',)","10.2175/193864710798216792","","Optimal Module Configuration and Sparging Scenario for a Submerged Hollow Fiber Membrane System"
"","Optimization of air sparging and in-line coagulation for ultrafiltration fouling control","Q13442814","('Pierre Bérubé',)","10.1016/j.seppur.2017.06.064","","Optimization of air sparging and in-line coagulation for ultrafiltration fouling control"
"","Optimizing the sparging condition and membrane module spacing for a ZW500 submerged hollow fiber membrane system","Q13442814","('Pierre Bérubé',)","10.5004/dwt.2012.2443","","Optimizing the sparging condition and membrane module spacing for a ZW500 submerged hollow fiber membrane system"
"","PFAS removal by ion exchange resins: A review","Q13442814","('Pierre Bérubé',)","10.1016/j.chemosphere.2021.129777","ion exchange","PFAS removal by ion exchange resins: A review"
"","Performance of thin-film composite hollow fiber nanofiltration for the removal of dissolved Mn, Fe and NOM from domestic groundwater supplies","Q13442814","('Pierre Bérubé',)","10.1016/j.watres.2018.08.032","water","Performance of thin-film composite hollow fiber nanofiltration for the removal of dissolved Mn, Fe and NOM from domestic groundwater supplies"
"","Physical cleaning efficacy of hollow fiber nanofiltration membranes in drinking water applications.","Q13442814","('Pierre Bérubé',)","10.5004/dwt.2017.20184","drinking water","Physical cleaning efficacy of hollow fiber nanofiltration membranes in drinking water applications."
"","Power induced by bubbles of different sizes and frequencies on to hollow fibers in submerged membrane systems","Q13442814","('Pierre Bérubé',)","10.1016/j.watres.2013.08.020","ecological modelling","Power induced by bubbles of different sizes and frequencies on to hollow fibers in submerged membrane systems"
"","Promoting the biological oxidation of reduced sulphur compounds by pH adjustment in a high temperature membrane bioreactor treating Kraft Pulp Mill Foul Condensate","Q13442814","('Pierre Bérubé',)","10.2166/wqrj.2001.006","water science and technology","Promoting the biological oxidation of reduced sulphur compounds by pH adjustment in a high temperature membrane bioreactor treating Kraft Pulp Mill Foul Condensate"
"","Pulse bubble sparging for fouling control","Q13442814","('Pierre Bérubé',)","10.1016/j.seppur.2014.07.023","filtration and separation","Pulse bubble sparging for fouling control"
"","Pulse bubble sparging for the control of hydraulically reversible fouling in submerged hollow fiber membrane systems","Q13442814","('Pierre Bérubé',)","10.1016/j.seppur.2013.12.011","filtration and separation","Pulse bubble sparging for the control of hydraulically reversible fouling in submerged hollow fiber membrane systems"
"","Quantifying the shear at the surface of submerged hollow fiber membranes","Q13442814","('Pierre Bérubé',)","10.1016/j.memsci.2005.12.043","membranes","Quantifying the shear at the surface of submerged hollow fiber membranes"
"","Rate and extent NOM removal during oxidation and biofiltration","Q13442814","('Pierre Bérubé',)","10.1016/j.watres.2013.12.017","ecological modelling","Rate and extent NOM removal during oxidation and biofiltration"
"","Relationship between types of surface shear stress profiles and membrane fouling","Q13442814","('Pierre Bérubé',)","10.1016/j.watres.2011.09.031","","Relationship between types of surface shear stress profiles and membrane fouling"
"","Removal of disinfection by-product precursors with ozone-UV advanced oxidation process","Q13442814","('Pierre Bérubé',)","10.1016/j.watres.2005.03.021","ozone","Removal of disinfection by-product precursors with ozone-UV advanced oxidation process"
"","Reuse of Air for Return Activated Sludge Pumping in Submerged Membrane Bioreactors","Q13442814","('Pierre Bérubé',)","10.1002/cite.201500080","industrial and manufacturing engineering","Reuse of Air for Return Activated Sludge Pumping in Submerged Membrane Bioreactors"
"","Roles of various mixed liquor constituents in membrane filtration of activated sludge","Q13442814","('Pierre Bérubé',)","10.5004/dwt.2009.108","pollution","Roles of various mixed liquor constituents in membrane filtration of activated sludge"
"","SEM imaging of membranes: Importance of sample preparation and imaging parameters","Q13442814","('Pierre Bérubé',)","10.1016/j.memsci.2014.03.048","membranes","SEM imaging of membranes: Importance of sample preparation and imaging parameters"
"","Seeking realistic membrane ageing at bench-scale","Q13442814","('Pierre Bérubé',)","10.1016/j.memsci.2020.118606","physical and theoretical chemistry","Seeking realistic membrane ageing at bench-scale"
"","Student Learning in Teams: Viewpoint of Team Members, Teachers and an Observer","Q13442814","('Pierre Bérubé',)","10.11120/ened.2007.02010002","","Student Learning in Teams: Viewpoint of Team Members, Teachers and an Observer"
"","Study of submerged anaerobic membrane bioreactor (AnMBR) treating municipal wastewater","Q13442814","('Pierre Bérubé',)","10.2175/193864710798182060","water","Study of submerged anaerobic membrane bioreactor (AnMBR) treating municipal wastewater"
"","Surface shear stress and membrane fouling when considering natural water matrices","Q13442814","('Pierre Bérubé',)","10.1016/j.desal.2013.09.018","water","Surface shear stress and membrane fouling when considering natural water matrices"
"","Surface shear stress and retention of emerging contaminants during ultrafiltration for drinking water treatment","Q13442814","('Pierre Bérubé',)","10.1016/j.seppur.2013.11.003","drinking water","Surface shear stress and retention of emerging contaminants during ultrafiltration for drinking water treatment"
"","The effect of concentration factor on membrane fouling","Q13442814","('Pierre Bérubé',)","10.3390/membranes7030050","","The effect of concentration factor on membrane fouling"
"","The effect of hydrodynamic conditions and system configurations on the permeate flux in a submerged hollow fiber membrane system","Q13442814","('Pierre Bérubé',)","10.1016/j.memsci.2005.07.006","physical and theoretical chemistry","The effect of hydrodynamic conditions and system configurations on the permeate flux in a submerged hollow fiber membrane system"
"","The impact of loading approach and biological activity on NOM removal by ion exchange resins","Q13442814","('Pierre Bérubé',)","10.1016/j.watres.2018.01.052","ion exchange","The impact of loading approach and biological activity on NOM removal by ion exchange resins"
"","The importance of fluid dynamics for MBR fouling mitigation","Q13442814","('Pierre Bérubé',)","10.1016/j.biortech.2012.05.069","","The importance of fluid dynamics for MBR fouling mitigation"
"","Ultrafiltration fouling: Impact of backwash frequency and air sparging","Q13442814","('Pierre Bérubé',)","10.1080/01496395.2014.948964","","Ultrafiltration fouling: Impact of backwash frequency and air sparging"
"","Ultrafiltration organic fouling control: Comparison of air‐sparging and coagulation","Q13442814","('Pierre Bérubé',)","10.5942/jawwa.2014.106.0018","","Ultrafiltration organic fouling control: Comparison of air‐sparging and coagulation"
"","Variability and limits of the unified membrane fouling index: application to the reduction of low-pressure membrane fouling by ozonation and biofiltration","Q13442814","('Pierre Bérubé',)","10.1080/19443994.2012.672214","","Variability and limits of the unified membrane fouling index: application to the reduction of low-pressure membrane fouling by ozonation and biofiltration"
