"Processing of Aquatic Invertebrates Colonizing Decomposing Litter","Q13442814","Q56794616","10.1007/978-3-030-30515-4_49","Processing of Aquatic Invertebrates Colonizing Decomposing Litter","2020-07-30T17:26:56Z"
"Production and Transformation of Mixed-Valent Nanoparticles Generated by Fe(0) Electrocoagulation","Q13442814","Madjid Mohseni","10.1021/es505059d","Production and Transformation of Mixed-Valent Nanoparticles Generated by Fe(0) Electrocoagulation","2015-01-21T23:07:57Z"
"Production of organically bound halogens by the litter-degrading fungus Lepista nuda","Q13442814","Gunilla Öberg","10.1016/s0038-0717(99)00069-3","Production of organically bound halogens by the litter-degrading fungus Lepista nuda","2002-07-25T13:27:35Z"
"Production of organically-bound chlorine during degradation of birch wood by common white-rot fungi","Q13442814","Gunilla Öberg","10.1016/s0038-0717(96)00242-8","Production of organically-bound chlorine during degradation of birch wood by common white-rot fungi","2002-07-25T13:27:35Z"
"Programme Committee Members","Q13442814","Q56794616","10.1109/iccpct.2014.7055068","Programme Committee Members","2015-03-10T21:40:40Z"
"Progress towards understanding the structure, function, and ecological significance of small stream channels and their riparian zones","Q13442814","Q56794616","10.1139/x03-146","Progress towards understanding the structure, function, and ecological significance of small stream channels and their riparian zones","2003-08-08T20:00:35Z"
"Project deployment strategies for community renewable energy: A dynamic multi-period planning approach","Q13442814","Rehan Sadiq","10.1016/j.renene.2020.01.045","Project deployment strategies for community renewable energy: A dynamic multi-period planning approach","2020-01-17T01:28:05Z"
"Projected deglaciation of western Canada in the twenty-first century","Q13442814","Valentina Radić","10.1038/ngeo2407","Projected deglaciation of western Canada in the twenty-first century","2015-04-07T12:57:32Z"
"Promise, performance and current limitations of a magnetic Bedload Movement Detector","Q13442814","Marwan Hassan","10.1002/esp.1797","Promise, performance and current limitations of a magnetic Bedload Movement Detector","2009-04-02T10:37:18Z"
"Promoting the biological oxidation of reduced sulphur compounds by pH adjustment in a high temperature membrane bioreactor treating Kraft Pulp Mill Foul Condensate","Q13442814","Pierre Bérubé","10.2166/wqrj.2001.006","Promoting the biological oxidation of reduced sulphur compounds by pH adjustment in a high temperature membrane bioreactor treating Kraft Pulp Mill Foul Condensate","2018-05-28T07:56:42Z"
"Prospects of integrating carbon capturing into community scale energy systems","Q13442814","Rehan Sadiq","10.1016/j.rser.2020.110193","Prospects of integrating carbon capturing into community scale energy systems","2020-08-26T16:25:56Z"
"Protocol for Determining Ultraviolet Light Emitting Diode (UV-LED) Fluence for Microbial Inactivation Studies","Q13442814","Madjid Mohseni","10.1021/acs.est.7b05797","Protocol for Determining Ultraviolet Light Emitting Diode (UV-LED) Fluence for Microbial Inactivation Studies","2018-06-01T18:39:36Z"
"Protocol for determining ultraviolet light emitting diode (UV-LED) fluence for microbial inactivation studies","Q13442814","Madjid Mohseni","10.1021/acs.est.7b05797.s001","Protocol for determining ultraviolet light emitting diode (UV-LED) fluence for microbial inactivation studies","2020-04-08T16:56:58Z"
"Public participation and perceptions of watershed modeling","Q13442814","Mark Johnson","10.1080/08941920802220347","Public participation and perceptions of watershed modeling","2008-12-19T08:28:04Z"
"Pulse bubble sparging for fouling control","Q13442814","Pierre Bérubé","10.1016/j.seppur.2014.07.023","Pulse bubble sparging for fouling control","2014-07-21T17:45:20Z"
"Pulse bubble sparging for the control of hydraulically reversible fouling in submerged hollow fiber membrane systems","Q13442814","Pierre Bérubé","10.1016/j.seppur.2013.12.011","Pulse bubble sparging for the control of hydraulically reversible fouling in submerged hollow fiber membrane systems","2013-12-20T15:45:18Z"
"Quality Function Deployment (QFD) for Bridge Maintenance","Q13442814","Rehan Sadiq","10.1007/springerreference_7120","Quality Function Deployment (QFD) for Bridge Maintenance","2011-08-01T13:52:55Z"
"Quantifying active and passive restoration in Central Mexico from 1986-2012: assessing the evidence of a forest transition","Q13442814","Jordi Honey-Rosés","10.1111/rec.12703","Quantifying active and passive restoration in Central Mexico from 1986-2012: assessing the evidence of a forest transition","2018-03-15T10:53:10Z"
"Quantifying hydrologic connectivity of wetlands to surface water systems","Q13442814","Q57582079","10.5194/hess-21-1791-2017","Quantifying hydrologic connectivity of wetlands to surface water systems","2017-03-28T10:16:10Z"
"Quantifying the shear at the surface of submerged hollow fiber membranes","Q13442814","Pierre Bérubé","10.1016/j.memsci.2005.12.043","Quantifying the shear at the surface of submerged hollow fiber membranes","2006-01-31T12:39:07Z"
"Questioning to Learn and Learning to Question","Q13442814","Gunilla Öberg","10.1002/9781444328486.ch3","Questioning to Learn and Learning to Question","2011-06-27T16:44:00Z"
"RIPARIAN COMMUNITIES ASSOCIATED WITH PACIFIC NORTHWEST HEADWATER STREAMS: ASSEMBLAGES, PROCESSES, AND UNIQUENESS1","Q13442814","Q56794616","10.1111/j.1752-1688.2005.tb04471.x","RIPARIAN COMMUNITIES ASSOCIATED WITH PACIFIC NORTHWEST HEADWATER STREAMS: ASSEMBLAGES, PROCESSES, AND UNIQUENESS1","2007-06-09T01:18:21Z"
"RM-DEMATEL: a new methodology to identify the key factors in PM 2.5","Q13442814","Rehan Sadiq","10.1007/s11356-015-4229-9","RM-DEMATEL: a new methodology to identify the key factors in PM 2.5","2015-03-01T23:36:28Z"
"Radiation field modeling of multi-lamp, homogeneous photoreactors","Q13442814","Madjid Mohseni","10.1016/j.jphotochem.2008.03.006","Radiation field modeling of multi-lamp, homogeneous photoreactors","2008-03-19T12:49:52Z"
"Radiative forcing of methane fluxes offsets net carbon dioxide uptake for a tropical flooded forest","Q13442814","Mark Johnson","10.1111/gcb.14615","Radiative forcing of methane fluxes offsets net carbon dioxide uptake for a tropical flooded forest","2019-03-11T01:35:05Z"
"Rain-fed and irrigated cropland-atmosphere water fluxes and their implications for agricultural production in Southern Amazonia","Q13442814","Mark Johnson","10.1016/j.agrformet.2018.03.023","Rain-fed and irrigated cropland-atmosphere water fluxes and their implications for agricultural production in Southern Amazonia","2018-04-09T23:04:28Z"
"Ranking discrete fuzzy linguistic performance based on TODIM method","Q13442814","Rehan Sadiq","10.1007/s13198-014-0317-3","Ranking discrete fuzzy linguistic performance based on TODIM method","2014-12-08T14:38:49Z"
"Rapid and objective characterization of channel morphology in a small, forested stream","Q13442814","Marwan Hassan","10.5194/esurf-2020-33","Rapid and objective characterization of channel morphology in a small, forested stream","2020-05-11T06:42:34Z"
"Rate and extent NOM removal during oxidation and biofiltration","Q13442814","Pierre Bérubé","10.1016/j.watres.2013.12.017","Rate and extent NOM removal during oxidation and biofiltration","2013-12-21T13:30:21Z"
"Re-Theorizing Politics in Water Governance","Q13442814","Leila M. Harris","10.3390/w11071470","Re-Theorizing Politics in Water Governance","2019-07-16T06:23:16Z"
"Reach‐scale contributions of road‐surface sediment to the Honna River, Haida Gwaii, BC","Q13442814","Marwan Hassan","10.1002/hyp.10874","Reach‐scale contributions of road‐surface sediment to the Honna River, Haida Gwaii, BC","2016-04-10T18:23:31Z"
"Recent (1999–2003) Canadian research on contemporary processes of river erosion and sedimentation, and river mechanics","Q13442814","Marwan Hassan","10.1002/hyp.5767","Recent (1999–2003) Canadian research on contemporary processes of river erosion and sedimentation, and river mechanics","2005-01-13T15:47:13Z"
"Recent waves of water governance: Constitutional reform and resistance to neoliberalization in Latin America (1990–2012)","Q13442814","Leila M. Harris","10.1016/j.geoforum.2013.07.009","Recent waves of water governance: Constitutional reform and resistance to neoliberalization in Latin America (1990–2012)","2013-08-15T17:26:17Z"
"Reconciling ‘actual’ risk with ‘perceived’ risk for distributed water quality: a QFD-based approach","Q13442814","Rehan Sadiq","10.2166/aqua.2011.108","Reconciling ‘actual’ risk with ‘perceived’ risk for distributed water quality: a QFD-based approach","2011-09-05T11:44:03Z"
"Recovery of dissolved methane from anaerobically treated food waste leachate using solvent-based membrane contactor","Q13442814","Jongho Lee","10.1016/j.watres.2020.115693","Recovery of dissolved methane from anaerobically treated food waste leachate using solvent-based membrane contactor","2020-03-04T18:01:49Z"
"Recycling nutrients contained in human excreta to agriculture: Pathways, processes, and products","Q13442814","Gunilla Öberg","10.1080/10643389.2018.1558889","Recycling nutrients contained in human excreta to agriculture: Pathways, processes, and products","2019-01-29T14:09:04Z"
"Redefining green buildings: BIM-based framework for zero impact civil infrastructure","Q13442814","Rehan Sadiq","10.1061/9780784482858.013","Redefining green buildings: BIM-based framework for zero impact civil infrastructure","2020-11-09T10:40:22Z"
"Reducing cost and environmental impact of wastewater treatment with denitrifying methanotrophs, anammox, and mainstream anaerobic treatment","Q13442814","Q88314953","10.1021/acs.est.9b04764.s001","Reducing cost and environmental impact of wastewater treatment with denitrifying methanotrophs, anammox, and mainstream anaerobic treatment","2020-04-07T23:52:38Z"
"Reframing human excreta management as part of food and farming systems","Q13442814","Gunilla Öberg","10.1016/j.watres.2020.115601","Reframing human excreta management as part of food and farming systems","2020-02-09T10:20:19Z"
"Regional and global projections of twenty-first century glacier mass changes in response to climate scenarios from global climate models","Q13442814","Valentina Radić","10.1007/s00382-013-1719-7","Regional and global projections of twenty-first century glacier mass changes in response to climate scenarios from global climate models","2013-04-01T06:13:22Z"
"Regional and global volumes of glaciers derived from statistical upscaling of glacier inventory data","Q13442814","Valentina Radić","10.1029/2009jf001373","Regional and global volumes of glaciers derived from statistical upscaling of glacier inventory data","2010-03-10T21:00:46Z"
"Regionally differentiated contribution of mountain glaciers and ice caps to future sea-level rise, Nat. Geosci., 4, 91–94","Q13442814","Valentina Radić","10.1038/ngeo1052","Regionally differentiated contribution of mountain glaciers and ice caps to future sea-level rise, Nat. Geosci., 4, 91–94","2011-01-10T09:46:46Z"
"Relations of interannual differences in stream litter breakdown with discharge: Bioassessment implications","Q13442814","Q56794616","10.1002/ecs2.2423","Relations of interannual differences in stream litter breakdown with discharge: Bioassessment implications","2018-09-17T19:26:51Z"
"Relationship between suspended sediment load, channel geometry and land area increment in the Yellow River Delta","Q13442814","Marwan Hassan","10.1016/j.catena.2006.01.003","Relationship between suspended sediment load, channel geometry and land area increment in the Yellow River Delta","2006-03-30T12:52:14Z"
"Relationship between types of surface shear stress profiles and membrane fouling","Q13442814","Pierre Bérubé","10.1016/j.watres.2011.09.031","Relationship between types of surface shear stress profiles and membrane fouling","2011-09-22T19:47:50Z"
"Relationships between soil hydrology and forest structure and composition in the southern Brazilian Amazon","Q13442814","Mark Johnson","10.1111/j.1654-1103.2007.tb02529.x","Relationships between soil hydrology and forest structure and composition in the southern Brazilian Amazon","2009-02-24T22:00:32Z"
"Relative abundance and movement of the carabid beetle Scaphinotus angusticollis in managed coniferous riparian forests of southwestern British Columbia","Q13442814","Q56794616","10.1139/x10-003","Relative abundance and movement of the carabid beetle Scaphinotus angusticollis in managed coniferous riparian forests of southwestern British Columbia","2010-05-04T19:46:01Z"
"Relative humidity gradients as a key constraint on terrestrial water and energy fluxes","Q13442814","Mark Johnson","10.31223/x59880","Relative humidity gradients as a key constraint on terrestrial water and energy fluxes","2020-12-01T18:46:05Z"
"Reliability Assessment for Water Supply Systems under Uncertainties","Q13442814","Rehan Sadiq","10.1061/(asce)wr.1943-5452.0000349","Reliability Assessment for Water Supply Systems under Uncertainties","2013-01-18T03:15:48Z"
"Removal and re-use of tar-contaminated sediments by freeze-dredging at a coking plant Lulea, Sweden.","Q13442814","Gunilla Öberg","10.2175/106143015x14362865226950","Removal and re-use of tar-contaminated sediments by freeze-dredging at a coking plant Lulea, Sweden.","2015-10-16T07:03:54Z"
"Removal of Microcystin-LR from spiked natural and synthetic waters by anion exchange","Q13442814","Madjid Mohseni","10.1016/j.scitotenv.2018.11.117","Removal of Microcystin-LR from spiked natural and synthetic waters by anion exchange","2018-11-19T07:28:58Z"
"Removal of disinfection by-product precursors with ozone-UV advanced oxidation process","Q13442814","Pierre Bérubé","10.1016/j.watres.2005.03.021","Removal of disinfection by-product precursors with ozone-UV advanced oxidation process","2005-05-11T11:49:23Z"
"Removal of legacy PFAS and other fluorotelomers: optimized regeneration strategies in DOM-rich waters","Q13442814","Madjid Mohseni","10.1016/j.watres.2020.116098","Removal of legacy PFAS and other fluorotelomers: optimized regeneration strategies in DOM-rich waters","2020-06-26T12:38:37Z"
"Removal of urea from swimming pool water by UV/VUV: The roles of additives, mechanisms, influencing factors, and reaction products","Q13442814","Rehan Sadiq","10.1016/j.watres.2019.05.098","Removal of urea from swimming pool water by UV/VUV: The roles of additives, mechanisms, influencing factors, and reaction products","2019-06-01T12:32:53Z"
"Renewable energy based mine reclamation strategy: A hybrid fuzzy-based network analysis","Q13442814","Rehan Sadiq","10.1016/j.jclepro.2019.05.073","Renewable energy based mine reclamation strategy: A hybrid fuzzy-based network analysis","2019-05-08T18:13:14Z"
"Renewable energy selection for net-zero energy communities: Life cycle based decision making under uncertainty","Q13442814","Rehan Sadiq","10.1016/j.renene.2018.06.086","Renewable energy selection for net-zero energy communities: Life cycle based decision making under uncertainty","2018-06-26T15:40:59Z"
"Renewable energy-based artificial ground freezing as an adaptation solution for sustainability of permafrost in post-climate change conditions","Q13442814","Nadja Kunz","10.1088/1755-1315/268/1/012128","Renewable energy-based artificial ground freezing as an adaptation solution for sustainability of permafrost in post-climate change conditions","2019-07-02T11:17:54Z"
"Reservoir Operation Optimized for Hydropower Production Reduces Conflict with Traditional Water Uses in the Senegal River","Q13442814","Steven Weijs","10.1061/(asce)wr.1943-5452.0001076","Reservoir Operation Optimized for Hydropower Production Reduces Conflict with Traditional Water Uses in the Senegal River","2020-02-08T15:30:52Z"
"Resource subsidies across the land–freshwater interface and responses in recipient communities","Q13442814","Q56794616","10.1002/rra.1283","Resource subsidies across the land–freshwater interface and responses in recipient communities","2009-07-06T05:33:27Z"
"Resource subsidy flows across freshwater–terrestrial boundaries and influence on processes linking adjacent ecosystems","Q13442814","Q56794616","10.1002/eco.1488","Resource subsidy flows across freshwater–terrestrial boundaries and influence on processes linking adjacent ecosystems","2014-03-13T21:06:46Z"
"Response of In‐Stream Wood to Riparian Timber Harvesting: Field Observations and Long‐Term Projections","Q13442814","Marwan Hassan","10.1029/2020wr027077","Response of In‐Stream Wood to Riparian Timber Harvesting: Field Observations and Long‐Term Projections","2020-06-22T10:24:02Z"
"Responses of a macroinvertebrate community from a pristine, southern British Columbia, Canada, stream to metals in experimental mesocosms","Q13442814","Q56794616","10.1002/etc.5620190328","Responses of a macroinvertebrate community from a pristine, southern British Columbia, Canada, stream to metals in experimental mesocosms","2010-03-17T07:52:37Z"
"Responses of invertebrates and algae of a boreal coniferous forest stream to experimental manipulation of leaf litter inputs and shading","Q13442814","Q56794616","10.1023/b:hydr.0000026506.16929.e1","Responses of invertebrates and algae of a boreal coniferous forest stream to experimental manipulation of leaf litter inputs and shading","2004-05-05T12:34:03Z"
"Responses of organic matter and macroinvertebrates to placements of boulder clusters in a small stream of southwestern British Columbia, Canada","Q13442814","Q56794616","10.1139/f03-013","Responses of organic matter and macroinvertebrates to placements of boulder clusters in a small stream of southwestern British Columbia, Canada","2003-06-17T17:36:01Z"
"Responses of periphyton and insect consumers to experimental manipulation of riparian buffer width along headwater streams in forested landscapes","Q13442814","Q56794616","10.1111/j.1365-2664.2003.00855.x","Responses of periphyton and insect consumers to experimental manipulation of riparian buffer width along headwater streams in forested landscapes","2003-12-15T11:55:46Z"
"Retention of chloride in soil and cycling of organic matter‐bound chlorine","Q13442814","Gunilla Öberg","10.1002/hyp.5680","Retention of chloride in soil and cycling of organic matter‐bound chlorine","2005-04-19T12:17:37Z"
"Retention, breakdown, and biological utilisation of deciduous tree leaves in an estuarine tidal flat of southwestern British Columbia, Canada","Q13442814","Q56794616","10.1139/f07-151","Retention, breakdown, and biological utilisation of deciduous tree leaves in an estuarine tidal flat of southwestern British Columbia, Canada","2008-03-03T20:03:59Z"
"Rethinking investment planning and optimizing net zero emission buildings","Q13442814","Rehan Sadiq","10.1007/s10098-017-1359-4","Rethinking investment planning and optimizing net zero emission buildings","2017-04-29T04:11:32Z"
"Rethinking the human right to water: Water access and dispossession in Botswana’s Central Kalahari Game Reserve","Q13442814","Q58348879","10.1016/j.geoforum.2013.06.012","Rethinking the human right to water: Water access and dispossession in Botswana’s Central Kalahari Game Reserve","2013-07-24T07:05:10Z"
"Reuse of Air for Return Activated Sludge Pumping in Submerged Membrane Bioreactors","Q13442814","Pierre Bérubé","10.1002/cite.201500080","Reuse of Air for Return Activated Sludge Pumping in Submerged Membrane Bioreactors","2015-09-17T10:31:28Z"
"Reviewing source water protection strategies: A conceptual model for water quality assessment","Q13442814","Rehan Sadiq","10.1139/a11-001","Reviewing source water protection strategies: A conceptual model for water quality assessment","2011-04-24T20:24:52Z"
"Revision and synopsis of the caddisfly genus Dicosmoecus (Trichoptera: Limnephilidae; Dicosmoecinae)","Q13442814","Q56794616","10.1080/01650428209361106","Revision and synopsis of the caddisfly genus Dicosmoecus (Trichoptera: Limnephilidae; Dicosmoecinae)","2008-09-30T21:58:48Z"
"Revision of the Onocosmoecus unicolor group (Trichoptera: Limnephilidae, Dicosmoecinae)","Q13442814","Q56794616","10.1155/1986/82592","Revision of the Onocosmoecus unicolor group (Trichoptera: Limnephilidae, Dicosmoecinae)","2008-04-17T22:29:21Z"
"Revisiting the Human Right to Water from an environmental justice lens","Q13442814","Leila M. Harris","10.1080/21565503.2015.1080619","Revisiting the Human Right to Water from an environmental justice lens","2015-09-14T20:46:35Z"
"Revisiting the Human Right to Water from an environmental justice lens","Q13442814","Q58348879","10.1080/21565503.2015.1080619","Revisiting the Human Right to Water from an environmental justice lens","2015-09-14T20:46:35Z"
"Rigorous but not Rigid","Q13442814","Gunilla Öberg","10.1002/9781444328486.ch6","Rigorous but not Rigid","2011-06-27T12:44:00Z"
"Riparian canopy type and management history control forest-to-stream plant litter fluxes","Q13442814","Q56794616","10.1139/x11-067","Riparian canopy type and management history control forest-to-stream plant litter fluxes","2011-07-26T13:48:35Z"
"Riparian forest harvesting and its influence on benthic communities of small streams of sub-boreal British Columbia","Q13442814","Q56794616","10.1139/x06-286","Riparian forest harvesting and its influence on benthic communities of small streams of sub-boreal British Columbia","2007-07-31T17:37:55Z"
"Risk analysis for oil & gas pipelines: A sustainability assessment approach using fuzzy based bow-tie analysis","Q13442814","Rehan Sadiq","10.1016/j.jlp.2011.12.007","Risk analysis for oil & gas pipelines: A sustainability assessment approach using fuzzy based bow-tie analysis","2011-12-20T18:33:47Z"
"Risk analysis for water quality deterioration in distribution networks","Q13442814","Rehan Sadiq","10.1061/40507(282)15","Risk analysis for water quality deterioration in distribution networks","2008-11-04T17:09:03Z"
"Risk analysis in a linguistic environment: a fuzzy evidential reasoning-based approach","Q13442814","Rehan Sadiq","10.1016/j.eswa.2011.06.018","Risk analysis in a linguistic environment: a fuzzy evidential reasoning-based approach","2011-07-05T08:26:30Z"
"Risk and life cycle cost based asset management framework for aging water supply system","Q13442814","Rehan Sadiq","10.4324/9781315142074-16","Risk and life cycle cost based asset management framework for aging water supply system","2019-02-07T14:34:39Z"
"Risk management of large-diameter water transmission mains","Q13442814","Rehan Sadiq","10.1061/40800(180)20","Risk management of large-diameter water transmission mains","2005-12-21T10:47:59Z"
"Risk-Based Framework for Improving Customer Satisfaction through System Reliability in Small-Sized to Medium-Sized Water Utilities","Q13442814","Rehan Sadiq","10.1061/(asce)me.1943-5479.0000435","Risk-Based Framework for Improving Customer Satisfaction through System Reliability in Small-Sized to Medium-Sized Water Utilities","2016-03-28T15:30:24Z"
"Risk-based decision-making for drilling waste discharges using a fuzzy synthetic evaluation technique","Q13442814","Rehan Sadiq","10.1016/j.oceaneng.2004.05.001","Risk-based decision-making for drilling waste discharges using a fuzzy synthetic evaluation technique","2004-08-31T13:27:23Z"
"Risk-based environmental decision-making using fuzzy analytic hierarchy process (F-AHP)","Q13442814","Rehan Sadiq","10.1007/s00477-006-0042-9","Risk-based environmental decision-making using fuzzy analytic hierarchy process (F-AHP)","2006-03-17T10:49:44Z"
"Risk-based framework for optimizing residual chlorine in large water distribution systems","Q13442814","Rehan Sadiq","10.1007/s10661-017-5989-0","Risk-based framework for optimizing residual chlorine in large water distribution systems","2017-06-01T21:40:37Z"
"Risk-based prioritization of air pollution monitoring using fuzzy synthetic evaluation technique","Q13442814","Rehan Sadiq","10.1007/s10661-005-3852-1","Risk-based prioritization of air pollution monitoring using fuzzy synthetic evaluation technique","2005-05-03T12:51:18Z"
"Risk-based prioritization of water main failure using fuzzy synthetic evaluation technique","Q13442814","Rehan Sadiq","10.2166/aqua.2015.051","Risk-based prioritization of water main failure using fuzzy synthetic evaluation technique","2015-12-15T08:49:12Z"
"Risk-based process safety assessment and control measures design for offshore process facilities","Q13442814","Rehan Sadiq","10.1016/s0304-3894(02)00004-3","Risk-based process safety assessment and control measures design for offshore process facilities","2002-10-14T19:21:38Z"
"Risk-sensitive foraging by juvenile signal crayfish (Pacifastacus leniusculus)","Q13442814","Q56794616","10.1139/z06-161","Risk-sensitive foraging by juvenile signal crayfish (Pacifastacus leniusculus)","2007-05-08T18:06:15Z"
"River Restoration Design Framework","Q13442814","Marwan Hassan","10.31223/osf.io/eus6c","River Restoration Design Framework","2018-07-02T13:28:43Z"
"River restoration","Q13442814","Marwan Hassan","10.4016/10452.01","River restoration","2009-04-21T07:28:10Z"
"Role of pressure in organic fouling in forward osmosis and reverse osmosis","Q13442814","Jongho Lee","10.1016/j.memsci.2015.07.033","Role of pressure in organic fouling in forward osmosis and reverse osmosis","2015-07-18T00:58:21Z"
"Role of solution concentration, cement alkali and test duration on expansion of accelerated mortar bar test (AMBT)","Q13442814","Rehan Sadiq","10.1617/s11527-015-0626-2","Role of solution concentration, cement alkali and test duration on expansion of accelerated mortar bar test (AMBT)","2015-05-08T15:56:47Z"
