"Drinking water management and governance in Canada: an innovative Plan-Do-Check-Act (PDCA) framework for a safe drinking water supply","Q13442814","Rehan Sadiq","10.1007/s00267-017-0873-9","Drinking water management and governance in Canada: an innovative Plan-Do-Check-Act (PDCA) framework for a safe drinking water supply","2017-04-19T11:46:35Z"
"Drinking water quality assessment in distribution networks: A water footprint approach","Q13442814","Rehan Sadiq","10.1016/j.scitotenv.2021.145844","Drinking water quality assessment in distribution networks: A water footprint approach","2021-02-16T03:54:46Z"
"Drinking water quality guidelines across Canadian provinces and territories: Jurisdictional variation in the context of decentralized water governance","Q13442814","Leila M. Harris","10.3390/ijerph110504634","Drinking water quality guidelines across Canadian provinces and territories: Jurisdictional variation in the context of decentralized water governance","2014-04-28T09:15:00Z"
"Drinking-water management in Canadian provinces and territories: a review and comparison of management approaches for ensuring safe drinking water","Q13442814","Rehan Sadiq","10.2166/wp.2018.040","Drinking-water management in Canadian provinces and territories: a review and comparison of management approaches for ensuring safe drinking water","2018-01-11T01:22:09Z"
"Drivers for and against municipal wastewater recycling: A review","Q13442814","Nadja Kunz","10.2166/wst.2015.496","Drivers for and against municipal wastewater recycling: A review","2016-02-01T11:06:23Z"
"Drivers, impacts, mechanisms and adaptation in insect invasions","Q13442814","Q56794616","10.1007/s10530-016-1088-3","Drivers, impacts, mechanisms and adaptation in insect invasions","2016-02-26T08:51:20Z"
"Drought may amplify the impacts of salt pollution in pond ecosystems: an experimental exploration","Q13442814","Q56794616","10.1127/fal/2020/1225","Drought may amplify the impacts of salt pollution in pond ecosystems: an experimental exploration","2020-08-01T01:05:25Z"
"Dynamic Pressure Measurements in a Circulating Fluidized Bed","Q13442814","Madjid Mohseni","10.33915/etd.2749","Dynamic Pressure Measurements in a Circulating Fluidized Bed","2019-08-06T20:07:26Z"
"EVOLUTION OF RIVER LONG-PROFILES, ORGANIZATION OF PROCESS DOMAINS AND DOWNSTREAM HYDRAULIC GEOMETRY IN GLACIATED DRAINAGE BASINS OF COASTAL BRITISH COLUMBIA","Q13442814","Marwan Hassan","10.1029/2005jf000358","EVOLUTION OF RIVER LONG-PROFILES, ORGANIZATION OF PROCESS DOMAINS AND DOWNSTREAM HYDRAULIC GEOMETRY IN GLACIATED DRAINAGE BASINS OF COASTAL BRITISH COLUMBIA","2006-02-22T16:26:20Z"
"EXPERIMENTAL MEASUREMENTS OF SHEAR STRESS IN A TUBULAR AIR LIFT MEMBRANE SYSTEM","Q13442814","Pierre Bérubé","10.2166/wst.2011.521","EXPERIMENTAL MEASUREMENTS OF SHEAR STRESS IN A TUBULAR AIR LIFT MEMBRANE SYSTEM","2011-07-14T11:17:38Z"
"Ecohydrological responses to rewetting of a highly impacted raised bog ecosystem","Q13442814","Mark Johnson","10.1002/eco.1922","Ecohydrological responses to rewetting of a highly impacted raised bog ecosystem","2017-10-27T21:56:36Z"
"Ecohydrology and biogeochemistry of the rhizosphere in forested ecosystems","Q13442814","Mark Johnson","10.1007/978-94-007-1363-5_24","Ecohydrology and biogeochemistry of the rhizosphere in forested ecosystems","2011-06-15T03:28:25Z"
"Ecological Linkages Between Headwaters and Downstream Ecosystems: Transport of Organic Matter, Invertebrates, and Wood Down Headwater Channels1","Q13442814","Q56794616","10.1111/j.1752-1688.2007.00007.x","Ecological Linkages Between Headwaters and Downstream Ecosystems: Transport of Organic Matter, Invertebrates, and Wood Down Headwater Channels1","2010-08-05T05:27:00Z"
"Ecological neighborhoods: scaling environmental patterns","Q13442814","Q56794616","10.2307/3565770","Ecological neighborhoods: scaling environmental patterns","2006-11-16T17:56:53Z"
"Ecological risk assessment of accidental release of flowback water: A conceptual framework","Q13442814","Rehan Sadiq","10.1080/10807039.2017.1385384","Ecological risk assessment of accidental release of flowback water: A conceptual framework","2017-10-06T20:35:16Z"
"Ecological risk assessment of acid rock drainage under uncertainty: The fugacity approach","Q13442814","Rehan Sadiq","10.1016/j.eti.2015.07.004","Ecological risk assessment of acid rock drainage under uncertainty: The fugacity approach","2015-09-29T22:53:26Z"
"Economic and Energy Efficiency of Net-Zero Water Communities: System Dynamics Analysis","Q13442814","Rehan Sadiq","10.1061/jswbay.0000854","Economic and Energy Efficiency of Net-Zero Water Communities: System Dynamics Analysis","2018-04-20T07:33:32Z"
"Economic evaluation of building energy retrofits: A fuzzy based approach","Q13442814","Rehan Sadiq","10.1016/j.enbuild.2017.01.031","Economic evaluation of building energy retrofits: A fuzzy based approach","2017-01-12T19:16:50Z"
"Ecosystem services of a functionally diverse riparian zone in the Amazon–Cerrado agricultural frontier","Q13442814","Mark Johnson","10.32942/osf.io/85ypg","Ecosystem services of a functionally diverse riparian zone in the Amazon–Cerrado agricultural frontier","2019-08-21T20:58:55Z"
"Effect of regulations and treatment technologies on water distribution infrastructure","Q13442814","Rehan Sadiq","10.1002/j.1551-8833.2009.tb09860.x","Effect of regulations and treatment technologies on water distribution infrastructure","2018-02-23T00:41:23Z"
"Effect of stress history on sediment transport and channel adjustment in graded gravel-bed rivers","Q13442814","Marwan Hassan","10.5194/egusphere-egu21-6889","Effect of stress history on sediment transport and channel adjustment in graded gravel-bed rivers","2021-03-04T03:19:29Z"
"Effect of vacuum UV irradiation on the concentration of dissolved cyanobacterial toxin microcystin-LR","Q13442814","Madjid Mohseni","10.2166/ws.2017.214","Effect of vacuum UV irradiation on the concentration of dissolved cyanobacterial toxin microcystin-LR","2017-10-28T00:25:23Z"
"Effective discharge in small formerly glaciated mountain streams of British Columbia: Limitations and implications","Q13442814","Marwan Hassan","10.1002/2013wr014529","Effective discharge in small formerly glaciated mountain streams of British Columbia: Limitations and implications","2014-05-05T23:53:48Z"
"Effects of Land-use Changes and Stormflow-detention Basins on Flooding and Nonpoint-source Pollution, in Irondequoit Creek Basin, Monroe and Ontario Counties, New York …","Q13442814","Mark Johnson","10.3133/sir20055070","Effects of Land-use Changes and Stormflow-detention Basins on Flooding and Nonpoint-source Pollution, in Irondequoit Creek Basin, Monroe and Ontario Counties, New York …","2018-08-15T18:35:07Z"
"Effects of Nonylphenol on Tail Resorption and Metamorphic Staging in Rana catesbeiana Tadpoles","Q13442814","Q56794616","10.1016/0016-6480(76)90051-4","Effects of Nonylphenol on Tail Resorption and Metamorphic Staging in Rana catesbeiana Tadpoles","2005-02-10T19:49:14Z"
"Effects of UV/H2O2 advanced oxidation on chemical characteristics and chlorine reactivity of surface water natural organic matter","Q13442814","Madjid Mohseni","10.1016/j.watres.2010.05.025","Effects of UV/H2O2 advanced oxidation on chemical characteristics and chlorine reactivity of surface water natural organic matter","2010-06-02T05:34:27Z"
"Effects of bottleneck blockage on the resilience of an urban stormwater drainage system","Q13442814","Rehan Sadiq","10.1080/02626667.2019.1690657","Effects of bottleneck blockage on the resilience of an urban stormwater drainage system","2019-11-08T10:32:26Z"
"Effects of elevated operating temperatures on methanol removal kinetics from synthetic kraft pulp mill condensate using a membrane bioreactor","Q13442814","Pierre Bérubé","10.1016/s0043-1354(00)00203-7","Effects of elevated operating temperatures on methanol removal kinetics from synthetic kraft pulp mill condensate using a membrane bioreactor","2002-07-25T14:32:20Z"
"Effects of food and cover on the growth, survival, and movement of cutthroat trout (Oncorhynchus clarki) in coastal streams","Q13442814","Q56794616","10.1139/f02-079","Effects of food and cover on the growth, survival, and movement of cutthroat trout (Oncorhynchus clarki) in coastal streams","2002-10-01T20:05:45Z"
"Effects of forest tent caterpillar defoliation on carbon and water fluxes in a boreal aspen stand","Q13442814","Mark Johnson","10.1016/j.agrformet.2018.01.035","Effects of forest tent caterpillar defoliation on carbon and water fluxes in a boreal aspen stand","2018-02-24T00:17:42Z"
"Effects of glacial retreat on proglacial streams and riparian zones in the Coast and North Cascade Mountains","Q13442814","Marwan Hassan","10.1002/esp.3453","Effects of glacial retreat on proglacial streams and riparian zones in the Coast and North Cascade Mountains","2013-06-11T15:07:28Z"
"Effects of inorganics on the degradation of micropollutants with vacuum UV (VUV) advanced oxidation","Q13442814","Madjid Mohseni","10.1080/10934529.2017.1282770","Effects of inorganics on the degradation of micropollutants with vacuum UV (VUV) advanced oxidation","2017-02-21T22:25:41Z"
"Effects of kraft evaporator condensate matrix on methanol removal in a high temperature membrane bioreactor","Q13442814","Pierre Bérubé","10.1016/s0273-1223(99)00735-0","Effects of kraft evaporator condensate matrix on methanol removal in a high temperature membrane bioreactor","2002-07-26T01:23:16Z"
"Effects of landuse intensification on stream basal resources and invertebrate communities","Q13442814","Q56794616","10.1086/693457","Effects of landuse intensification on stream basal resources and invertebrate communities","2017-06-28T17:06:05Z"
"Effects of light and nutrients on grazer-periphyton interactions","Q13442814","Q56794616","10.1080/03680770.2001.11901911","Effects of light and nutrients on grazer-periphyton interactions","2017-12-01T16:10:31Z"
"Effects of logging second-growth forests on headwater populations of coastal cutthroat trout: A 6-year, multistream, before-and-after field experiment","Q13442814","Q56794616","10.1577/t04-232.1","Effects of logging second-growth forests on headwater populations of coastal cutthroat trout: A 6-year, multistream, before-and-after field experiment","2007-02-02T17:26:37Z"
"Effects of ontogenetic stage and density on the ecological role of the signal crayfish (Pacifastacus leniusculus) in a coastal Pacific stream","Q13442814","Q56794616","10.1899/08-092.1","Effects of ontogenetic stage and density on the ecological role of the signal crayfish (Pacifastacus leniusculus) in a coastal Pacific stream","2009-03-09T15:00:39Z"
"Effects of pH and dilution on African clawed frog (Xenopus laevis) sperm motility","Q13442814","Q56794616","10.1139/z04-021","Effects of pH and dilution on African clawed frog (Xenopus laevis) sperm motility","2004-06-22T17:55:16Z"
"Effects of riparian forest harvest on streams: a meta‐analysis","Q13442814","Q56794616","10.1111/1365-2664.12332","Effects of riparian forest harvest on streams: a meta‐analysis","2014-09-01T16:31:07Z"
"Effects of seston quality on the growth of a lake-outlet filter feeder","Q13442814","Q56794616","10.2307/3544157","Effects of seston quality on the growth of a lake-outlet filter feeder","2006-11-16T12:51:44Z"
"Effects of small rivers on chemical properties of sediment and diets for primary consumers in estuarine tidal flats","Q13442814","Q56794616","10.3354/meps07388","Effects of small rivers on chemical properties of sediment and diets for primary consumers in estuarine tidal flats","2008-01-09T09:45:16Z"
"Effects of the bacterial insecticide Bacillus thuringiensis var. kurstaki (Btk) on a stream benthic community","Q13442814","Q56794616","10.1139/f94-103","Effects of the bacterial insecticide Bacillus thuringiensis var. kurstaki (Btk) on a stream benthic community","2008-06-24T18:39:29Z"
"Effects of tributary size on the resource supply and physical habitat at tributary junctions along two mainstem rivers","Q13442814","Q56794616","10.1139/cjfas-2019-0435","Effects of tributary size on the resource supply and physical habitat at tributary junctions along two mainstem rivers","2020-05-01T21:33:56Z"
"Efficacy of antifouling modification of ultrafiltration membranes by grafting zwitterionic polymer brushes","Q13442814","Jongho Lee","10.1016/j.seppur.2017.08.034","Efficacy of antifouling modification of ultrafiltration membranes by grafting zwitterionic polymer brushes","2017-08-15T00:00:40Z"
"Efficient removal of GenX (HFPO-DA) and other perfluorinated ether acids from drinking and recycled waters using anion exchange resins","Q13442814","Madjid Mohseni","10.1016/j.jhazmat.2019.121261","Efficient removal of GenX (HFPO-DA) and other perfluorinated ether acids from drinking and recycled waters using anion exchange resins","2019-09-24T23:33:10Z"
"Einstein conjecture and resting-time statistics in the bed-load transport of monodispersed particles","Q13442814","Marwan Hassan","10.1017/jfm.2019.563","Einstein conjecture and resting-time statistics in the bed-load transport of monodispersed particles","2019-08-14T12:51:33Z"
"Electrochemical Ferrates for Drinking Water Treatment: Quantification, Synthesis and Degradation Studies","Q13442814","Madjid Mohseni","10.1149/ma2017-02/54/2283","Electrochemical Ferrates for Drinking Water Treatment: Quantification, Synthesis and Degradation Studies","2020-02-27T01:55:59Z"
"Electrosynthesis of Near-Neutral Ferrate Species for Drinking Water Treatment Using a Recirculating Batch Reactor","Q13442814","Madjid Mohseni","10.1149/ma2018-01/20/1300","Electrosynthesis of Near-Neutral Ferrate Species for Drinking Water Treatment Using a Recirculating Batch Reactor","2020-02-27T02:00:28Z"
"Electrosynthesis of ferrate in a batch reactor at neutral conditions for drinking water applications","Q13442814","Madjid Mohseni","10.1002/cjce.23142","Electrosynthesis of ferrate in a batch reactor at neutral conditions for drinking water applications","2018-01-17T12:52:40Z"
"Elucidating syntrophic butyrate-degrading populations in anaerobic digesters using stable isotope-informed genome-resolved metagenomics","Q13442814","Q88314953","10.1101/563387","Elucidating syntrophic butyrate-degrading populations in anaerobic digesters using stable isotope-informed genome-resolved metagenomics","2019-03-01T11:05:11Z"
"Elucidating the Trade-off between Membrane Wetting Resistance and Water Vapor Flux in Membrane Distillation","Q13442814","Jongho Lee","10.1021/acs.est.0c02547.s001","Elucidating the Trade-off between Membrane Wetting Resistance and Water Vapor Flux in Membrane Distillation","2020-08-06T20:09:23Z"
"Elucidating the Trade-off between Membrane Wetting Resistance and Water Vapor Flux in Membrane Distillation","Q13442814","Jongho Lee","10.1021/acs.est.0c02547","Elucidating the Trade-off between Membrane Wetting Resistance and Water Vapor Flux in Membrane Distillation","2020-07-23T14:03:55Z"
"Emergy-based life cycle assessment (Em-LCA) for sustainability appraisal of infrastructure systems: a case study on paved roads","Q13442814","Rehan Sadiq","10.1007/s10098-013-0615-5","Emergy-based life cycle assessment (Em-LCA) for sustainability appraisal of infrastructure systems: a case study on paved roads","2013-04-12T16:15:34Z"
"Emergy-based life cycle assessment (Em-LCA) of multi-unit and single-family residential buildings in Canada","Q13442814","Rehan Sadiq","10.1016/j.ijsbe.2014.09.001","Emergy-based life cycle assessment (Em-LCA) of multi-unit and single-family residential buildings in Canada","2014-10-03T23:11:03Z"
"Empirical models to predict disinfection by-products (DBPs) in drinking water","Q13442814","Rehan Sadiq","10.1016/b978-0-444-52272-6.00282-8","Empirical models to predict disinfection by-products (DBPs) in drinking water","2011-03-07T23:05:56Z"
"Emulation of natural disturbance (END) for riparian forest management: synthesis and recommendations","Q13442814","Q56794616","10.1899/11-094.1","Emulation of natural disturbance (END) for riparian forest management: synthesis and recommendations","2012-01-24T18:35:38Z"
"Enabling high-accuracy long-read amplicon sequences using unique molecular identifiers with Nanopore or PacBio sequencing","Q13442814","Q88314953","10.1101/645903","Enabling high-accuracy long-read amplicon sequences using unique molecular identifiers with Nanopore or PacBio sequencing","2019-05-24T18:15:12Z"
"Energetic, environmental and economic performance of electric vehicles: Experimental evaluation","Q13442814","Rehan Sadiq","10.1016/j.trd.2014.11.015","Energetic, environmental and economic performance of electric vehicles: Experimental evaluation","2014-12-23T06:46:21Z"
"Energy Efficiency and Global Warming Potential in the Residential Sector: Comparative Evaluation of Canada and Saudi Arabia","Q13442814","Rehan Sadiq","10.1061/(asce)ae.1943-5568.0000253","Energy Efficiency and Global Warming Potential in the Residential Sector: Comparative Evaluation of Canada and Saudi Arabia","2017-04-28T12:00:02Z"
"Energy Performance Assessment Framework for Residential Buildings in Saudi Arabia","Q13442814","Rehan Sadiq","10.3390/su13042232","Energy Performance Assessment Framework for Residential Buildings in Saudi Arabia","2021-02-19T14:06:10Z"
"Energy consumption related to shear stress for membrane bioreactors used for wastewater treatment","Q13442814","Pierre Bérubé","10.2478/v10173-012-0012-1","Energy consumption related to shear stress for membrane bioreactors used for wastewater treatment","2013-01-18T03:53:04Z"
"Energy rating system for climate conscious operation of multi-unit residential buildings","Q13442814","Rehan Sadiq","10.1007/s10098-018-1510-x","Energy rating system for climate conscious operation of multi-unit residential buildings","2018-03-01T08:49:01Z"
"Energy recovery from ethanol in wastewater in a microbial fuel cell","Q13442814","Madjid Mohseni","10.1149/ma2010-02/4/276","Energy recovery from ethanol in wastewater in a microbial fuel cell","2020-02-26T23:55:23Z"
"Engineering Surface Energy and Nanostructure of Microporous Films for Expanded Membrane Distillation Applications","Q13442814","Jongho Lee","10.1021/acs.est.6b02316.s001","Engineering Surface Energy and Nanostructure of Microporous Films for Expanded Membrane Distillation Applications","2020-04-08T01:14:05Z"
"Enhanced fuzzy evidential reasoning using an optimization approach for water quality monitoring","Q13442814","Rehan Sadiq","10.1109/ifsa-nafips.2013.6608561","Enhanced fuzzy evidential reasoning using an optimization approach for water quality monitoring","2013-10-01T18:39:42Z"
"Enhanced water transport and salt rejection through hydrophobic zeolite pores","Q13442814","Jongho Lee","10.1088/1361-6528/aa9773","Enhanced water transport and salt rejection through hydrophobic zeolite pores","2017-11-01T20:00:08Z"
"Enhancement of UV/H2O2 Efficacy Using Strong Base Anion Exchange Resins","Q13442814","Madjid Mohseni","10.5942/jawwa.2016.108.0050","Enhancement of UV/H2O2 Efficacy Using Strong Base Anion Exchange Resins","2015-12-04T22:50:01Z"
"Entropy Ensemble Filter: A Modified Bootstrap Aggregating (Bagging) Procedure to Improve Efficiency in Ensemble Model Simulation","Q13442814","Steven Weijs","10.3390/e19100520","Entropy Ensemble Filter: A Modified Bootstrap Aggregating (Bagging) Procedure to Improve Efficiency in Ensemble Model Simulation","2017-09-28T15:22:44Z"
"Environmental Studies","Q13442814","Gunilla Öberg","10.1080/00207230214402","Environmental Studies","2003-09-18T22:32:58Z"
"Environmental and economic aspects of production and utilization of RDF as alternative fuel in cement plants: A case study of Metro Vancouver Waste Management","Q13442814","Rehan Sadiq","10.1016/j.resconrec.2013.10.009","Environmental and economic aspects of production and utilization of RDF as alternative fuel in cement plants: A case study of Metro Vancouver Waste Management","2013-11-06T23:15:45Z"
"Environmental assessment under uncertainty using Dempster–Shafer theory and Z-numbers","Q13442814","Rehan Sadiq","10.1007/s12652-019-01228-y","Environmental assessment under uncertainty using Dempster–Shafer theory and Z-numbers","2019-02-06T10:29:58Z"
"Environmental decision-making under uncertainty using intuitionistic fuzzy analytic hierarchy process (IF-AHP)","Q13442814","Rehan Sadiq","10.1007/s00477-007-0197-z","Environmental decision-making under uncertainty using intuitionistic fuzzy analytic hierarchy process (IF-AHP)","2007-11-27T07:42:32Z"
"Environmental risk assessment of acid rock drainage under uncertainty: the probability bounds and PHREEQC approach","Q13442814","Rehan Sadiq","10.1016/j.jhazmat.2015.07.022","Environmental risk assessment of acid rock drainage under uncertainty: the probability bounds and PHREEQC approach","2015-07-18T00:02:24Z"
"Erosion, Sedimentation, and Geomorphology-Sensitivity of bed load transport in Harris Creek: Seasonal and spatial variation over a cobble-gravel bar (Paper 2000WR900346)","Q13442814","Marwan Hassan","10.1029/2000wr900346","Erosion, Sedimentation, and Geomorphology-Sensitivity of bed load transport in Harris Creek: Seasonal and spatial variation over a cobble-gravel bar (Paper 2000WR900346)","2004-02-04T05:39:58Z"
"Erosion, Sedimentation, and Geomorphology-Stabilizing self-organized structures in gravel-bed stream channels: Field and experimental observations (Paper 98WR00484)","Q13442814","Marwan Hassan","10.1029/98wr00484","Erosion, Sedimentation, and Geomorphology-Stabilizing self-organized structures in gravel-bed stream channels: Field and experimental observations (Paper 98WR00484)","2004-02-04T04:40:50Z"
"Erratum to¿ The effect of hydrodynamic conditions and system configurations on the permeate flux in a submerged hollow fiber membrane system¿[J. Membr. Sci. 271 (2006) 29¿ 37]","Q13442814","Pierre Bérubé","10.1016/j.memsci.2006.01.048","Erratum to¿ The effect of hydrodynamic conditions and system configurations on the permeate flux in a submerged hollow fiber membrane system¿[J. Membr. Sci. 271 (2006) 29¿ 37]","2006-03-10T15:23:59Z"
"Erratum: Improved performance of a passive air breathing flat‐plate microbial fuel cell","Q13442814","Madjid Mohseni","10.1002/cjce.22190","Erratum: Improved performance of a passive air breathing flat‐plate microbial fuel cell","2015-03-24T16:09:57Z"
"Establishing light as a causal mechanism structuring stream communities in response to experimental manipulation of riparian buffer width","Q13442814","Q56794616","10.1899/0887-3593(2004)023<0542:elaacm>2.0.co;2","Establishing light as a causal mechanism structuring stream communities in response to experimental manipulation of riparian buffer width","2005-04-08T21:13:00Z"
"Estimating Stream Surface Flow Velocities from Video Clips","Q13442814","Steven Weijs","10.1109/icip.2015.7351509","Estimating Stream Surface Flow Velocities from Video Clips","2015-12-13T06:34:48Z"
"Estimating rates of wetland loss using power-law functions","Q13442814","Q57582079","10.1007/s13157-017-0960-y","Estimating rates of wetland loss using power-law functions","2017-10-23T21:22:13Z"
"Estimating risk of contaminant intrusion in distribution networks using fuzzy rule-based modeling","Q13442814","Rehan Sadiq","10.1080/10286600600789276","Estimating risk of contaminant intrusion in distribution networks using fuzzy rule-based modeling","2006-07-17T19:22:01Z"
"Estimating suspended sediment concentrations in areas with limited hydrological data using a mixed‐effects model","Q13442814","Marwan Hassan","10.1002/hyp.8462","Estimating suspended sediment concentrations in areas with limited hydrological data using a mixed‐effects model","2012-01-11T17:21:26Z"
"Estimating winter balance and its uncertainty from direct measurements of snow depth and density on alpine glaciers","Q13442814","Valentina Radić","10.1017/jog.2018.68","Estimating winter balance and its uncertainty from direct measurements of snow depth and density on alpine glaciers","2018-09-26T05:45:46Z"
"Euromembrane Conference 2012 [P3. 089] Efficient gas sparging design through characterising the hydrodynamics inside submerged HF membrane systems","Q13442814","Pierre Bérubé","10.1016/j.proeng.2012.08.985","Euromembrane Conference 2012 [P3. 089] Efficient gas sparging design through characterising the hydrodynamics inside submerged HF membrane systems","2012-11-08T00:52:48Z"
"Evaluating Water Use for Agricultural Intensification in Southern Amazonia Using the Water Footprint Sustainability Assessment","Q13442814","Mark Johnson","10.3390/w10040349","Evaluating Water Use for Agricultural Intensification in Southern Amazonia Using the Water Footprint Sustainability Assessment","2018-03-22T09:14:55Z"
"Evaluating leakage potential in water distribution systems: a fuzzy-based methodology","Q13442814","Rehan Sadiq","10.2166/aqua.2012.151","Evaluating leakage potential in water distribution systems: a fuzzy-based methodology","2015-12-15T08:42:11Z"
"Evaluating motivation of construction workers: A comparison of fuzzy rule-based model with the traditional expectancy theory","Q13442814","Rehan Sadiq","10.3846/13923730.2014.914103","Evaluating motivation of construction workers: A comparison of fuzzy rule-based model with the traditional expectancy theory","2016-07-12T13:18:29Z"
"Evaluating offshore technologies for produced water management using GreenPro-I—a risk-based life cycle analysis for green and clean process selection and …","Q13442814","Rehan Sadiq","10.1016/j.compchemeng.2004.11.003","Evaluating offshore technologies for produced water management using GreenPro-I—a risk-based life cycle analysis for green and clean process selection and …","2005-01-09T03:16:39Z"
