"Len","P31","P50","P356","P1476","P1433","P577"
"A New Approach to Quantify Evaporative Water Loss in Tropical Wetlands","Q13442814","Mark Johnson","10.5194/hessd-11-4017-2014","A New Approach to Quantify Evaporative Water Loss in Tropical Wetlands","Copernicus GmbH","2014-04-10"
"A contribution to harmonize water footprint assessments","Q13442814","Mark Johnson","10.1016/j.gloenvcha.2018.10.004","A contribution to harmonize water footprint assessments","Global Environmental Change","2018-10-25"
"A review of green-and blue-water resources and their trade-offs for future agricultural production in the Amazon Basin: what could irrigated agriculture mean for Amazonia?","Q13442814","Mark Johnson","10.5194/hess-20-2179-2016","A review of green-and blue-water resources and their trade-offs for future agricultural production in the Amazon Basin: what could irrigated agriculture mean for Amazonia?","Hydrology and Earth System Sciences","2016-06-07"
"A simple, direct method to measure dissolved CO2 using soda lime","Q13442814","Mark Johnson","10.4257/oeco.2008.1201.08","A simple, direct method to measure dissolved CO2 using soda lime","Oecologia Australis","2009-08-31"
"Application of SMR to modeling watersheds in the Catskill Mountains","Q13442814","Mark Johnson","10.1023/b:enmo.0000032096.13649.92","Application of SMR to modeling watersheds in the Catskill Mountains","Environmental Modeling & Assessment","2004-06-17"
"Application of biochar and nitrogen influences fluxes of CO2, CH4 and N2O in a forest soil","Q13442814","Mark Johnson","10.1016/j.jenvman.2016.12.066","Application of biochar and nitrogen influences fluxes of CO2, CH4 and N2O in a forest soil","Journal of Environmental Management","2017-02-03"
"Application of two hydrologic models with different runoff mechanisms to a hillslope dominated watershed in the northeastern US: a comparison of HSPF and SMR","Q13442814","Mark Johnson","10.1016/j.jhydrol.2003.07.005","Application of two hydrologic models with different runoff mechanisms to a hillslope dominated watershed in the northeastern US: a comparison of HSPF and SMR","Journal of Hydrology","2003-10-15"
"Biochar decreases dissolved organic carbon but not nitrate leaching in relation to vinasse application in a Brazilian sugarcane soil","Q13442814","Mark Johnson","10.1016/j.jenvman.2014.09.033","Biochar decreases dissolved organic carbon but not nitrate leaching in relation to vinasse application in a Brazilian sugarcane soil","Journal of Environmental Management","2014-10-17"
"Biochar feedstock and pyrolysis temperature effects on leachate: DOC characteristics and nitrate losses from a Brazilian Cerrado Arenosol mixed with agricultural waste biochars","Q13442814","Mark Johnson","10.1016/j.jenvman.2017.12.052","Biochar feedstock and pyrolysis temperature effects on leachate: DOC characteristics and nitrate losses from a Brazilian Cerrado Arenosol mixed with agricultural waste biochars","Journal of Environmental Management","2018-02-04"
"Biochar from Sugarcane Filtercake Reduces Soil CO2 Emissions Relative to Raw Residue and Improves Water Retention and Nutrient Availability in a Highly-Weathered Tropical Soil","Q13442814","Mark Johnson","10.1371/journal.pone.0098523","Biochar from Sugarcane Filtercake Reduces Soil CO2 Emissions Relative to Raw Residue and Improves Water Retention and Nutrient Availability in a Highly-Weathered Tropical Soil","PLoS ONE","2014-06-04"
"Biochar influences on soil CO2 and CH4 fluxes in response to wetting and drying cycles for a forest soil","Q13442814","Mark Johnson","10.1038/s41598-017-07224-6","Biochar influences on soil CO2 and CH4 fluxes in response to wetting and drying cycles for a forest soil","Scientific Reports","2017-07-24"
"Biochars from local agricultural waste residues contribute to soil quality and plant growth in a Cerrado region (Brazil) Arenosol","Q13442814","Mark Johnson","10.1111/gcbb.12489","Biochars from local agricultural waste residues contribute to soil quality and plant growth in a Cerrado region (Brazil) Arenosol","GCB Bioenergy","2017-11-20"
"CO2 efflux from Amazonian headwater streams represents a significant fate for deep soil respiration","Q13442814","Mark Johnson","10.1029/2008gl034619","CO2 efflux from Amazonian headwater streams represents a significant fate for deep soil respiration","Geophysical Research Letters","2008-09-02"
"Carbon biogeochemistry of a flooded Pantanal forest over three annual flood cycles","Q13442814","Mark Johnson","10.1007/s10533-018-0450-1","Carbon biogeochemistry of a flooded Pantanal forest over three annual flood cycles","Biogeochemistry","2018-05-17"
"Cattle production in Southern Amazonia: implications for land and water management","Q13442814","Mark Johnson","10.1088/1748-9326/ab30a7","Cattle production in Southern Amazonia: implications for land and water management","Environmental Research Letters","2019-07-10"
"Characterization of shortwave and longwave properties of several plastic film mulches and their impact on the surface energy balance and soil temperature","Q13442814","Mark Johnson","10.1016/j.solener.2020.11.058","Characterization of shortwave and longwave properties of several plastic film mulches and their impact on the surface energy balance and soil temperature","Solar Energy","2020-12-25"
"Citizen science for water quality monitoring: Data implications of citizen perspectives","Q13442814","Mark Johnson","10.1016/j.jenvman.2017.05.083","Citizen science for water quality monitoring: Data implications of citizen perspectives","Journal of Environmental Management","2017-07-01"
"Complementarity in mid-point impacts for water use in life cycle assessment applied to cropland and cattle production in Southern Amazonia","Q13442814","Mark Johnson","10.1016/j.jclepro.2019.02.021","Complementarity in mid-point impacts for water use in life cycle assessment applied to cropland and cattle production in Southern Amazonia","Journal of Cleaner Production","2019-02-10"
"Contrasting CO2 concentration discharge dynamics in headwater streams: A multi‐catchment comparison","Q13442814","Mark Johnson","10.1002/jgrg.20047","Contrasting CO2 concentration discharge dynamics in headwater streams: A multi‐catchment comparison","Journal of Geophysical Research: Biogeosciences","2013-03-13"
"DOC and DIC in flowpaths of Amazonian headwater catchments with hydrologically contrasting soils","Q13442814","Mark Johnson","10.1007/s10533-006-9029-3","DOC and DIC in flowpaths of Amazonian headwater catchments with hydrologically contrasting soils","Biogeochemistry","2006-07-06"
"Determining the Stability of Sugarcane Filtercake Biochar in Soils with Contrasting Levels of Organic Matter","Q13442814","Mark Johnson","10.3390/agriculture8060071","Determining the Stability of Sugarcane Filtercake Biochar in Soils with Contrasting Levels of Organic Matter","Agriculture","2018-05-29"
"Developing a hydrologic monitoring network in data‐scarce regions using open‐source arduino dataloggers","Q13442814","Mark Johnson","10.2134/ael2016.02.0011","Developing a hydrologic monitoring network in data‐scarce regions using open‐source arduino dataloggers","Agricultural & Environmental Letters","2016-04-29"
"Dinâmica dos atributos físico-químicos e variação sazonal dos estoques de carbono no solo em diferentes fitofisionomias do Pantanal Norte Mato-Grossense","Q13442814","Mark Johnson","10.1590/0100-67622015000200012","Dinâmica dos atributos físico-químicos e variação sazonal dos estoques de carbono no solo em diferentes fitofisionomias do Pantanal Norte Mato-Grossense","Revista Árvore","2015-06-04"
"Direct and continuous measurement of dissolved carbon dioxide in freshwater aquatic systems—method and applications","Q13442814","Mark Johnson","10.1002/eco.95","Direct and continuous measurement of dissolved carbon dioxide in freshwater aquatic systems—method and applications","Ecohydrology","2009-10-23"
"Discharge–calcium concentration relationships in streams of the Amazon and Cerrado of Brazil: soil or land use controlled","Q13442814","Mark Johnson","10.1007/s10533-011-9574-2","Discharge–calcium concentration relationships in streams of the Amazon and Cerrado of Brazil: soil or land use controlled","Biogeochemistry","2011-02-22"
"Distribuição espacial da granulometria, cor e carbono orgânico do solo ao longo de um transecto em microbacias na Amazônia meridional","Q13442814","Mark Johnson","10.1590/s0044-59672008000400015","Distribuição espacial da granulometria, cor e carbono orgânico do solo ao longo de um transecto em microbacias na Amazônia meridional","Acta Amazonica","2009-02-04"
"Distribuição espacial de carbono em solo sob floresta primária na Amazônia meridional","Q13442814","Mark Johnson","10.1590/s0100-67622007000100010","Distribuição espacial de carbono em solo sob floresta primária na Amazônia meridional","Revista Árvore","2007-04-11"
"Double-funneling of trees: Stemflow and root-induced preferential flow","Q13442814","Mark Johnson","10.2980/i1195-6860-13-3-324.1","Double-funneling of trees: Stemflow and root-induced preferential flow","Écoscience","2007-01-13"
"Ecohydrological responses to rewetting of a highly impacted raised bog ecosystem","Q13442814","Mark Johnson","10.1002/eco.1922","Ecohydrological responses to rewetting of a highly impacted raised bog ecosystem","Ecohydrology","2017-10-27"
"Ecohydrology and biogeochemistry of the rhizosphere in forested ecosystems","Q13442814","Mark Johnson","10.1007/978-94-007-1363-5_24","Ecohydrology and biogeochemistry of the rhizosphere in forested ecosystems","Forest Hydrology and Biogeochemistry","2011-06-15"
"Ecosystem services of a functionally diverse riparian zone in the Amazon–Cerrado agricultural frontier","Q13442814","Mark Johnson","10.32942/osf.io/85ypg","Ecosystem services of a functionally diverse riparian zone in the Amazon–Cerrado agricultural frontier","Center for Open Science","2019-08-21"
"Effects of Land-use Changes and Stormflow-detention Basins on Flooding and Nonpoint-source Pollution, in Irondequoit Creek Basin, Monroe and Ontario Counties, New York …","Q13442814","Mark Johnson","10.3133/sir20055070","Effects of Land-use Changes and Stormflow-detention Basins on Flooding and Nonpoint-source Pollution, in Irondequoit Creek Basin, Monroe and Ontario Counties, New York …","Scientific Investigations Report","2018-08-15"
"Effects of forest tent caterpillar defoliation on carbon and water fluxes in a boreal aspen stand","Q13442814","Mark Johnson","10.1016/j.agrformet.2018.01.035","Effects of forest tent caterpillar defoliation on carbon and water fluxes in a boreal aspen stand","Agricultural and Forest Meteorology","2018-02-24"
"Evaluating Water Use for Agricultural Intensification in Southern Amazonia Using the Water Footprint Sustainability Assessment","Q13442814","Mark Johnson","10.3390/w10040349","Evaluating Water Use for Agricultural Intensification in Southern Amazonia Using the Water Footprint Sustainability Assessment","Water","2018-03-22"
"Evaluating sampling efforts of standard laboratory analysis and mid-infrared spectroscopy for cost effective digital soil mapping at field scale","Q13442814","Mark Johnson","10.1016/j.geoderma.2019.113925","Evaluating sampling efforts of standard laboratory analysis and mid-infrared spectroscopy for cost effective digital soil mapping at field scale","Geoderma","2019-08-30"
"Examining CO2 concentrations and flow dynamics in streams","Q13442814","Mark Johnson","10.1002/2013eo230014","Examining CO2 concentrations and flow dynamics in streams","Eos, Transactions American Geophysical Union","2013-06-11"
"Fallow management practices in Guatemala's Western Highlands: Social drivers and biophysical impacts","Q13442814","Mark Johnson","10.1002/ldr.832","Fallow management practices in Guatemala's Western Highlands: Social drivers and biophysical impacts","Land Degradation & Development","2007-08-27"
"Fluorescence index as an indicator of dissolved organic carbon quality in hydrologic flowpaths of forested tropical watersheds","Q13442814","Mark Johnson","10.1007/s10533-011-9595-x","Fluorescence index as an indicator of dissolved organic carbon quality in hydrologic flowpaths of forested tropical watersheds","Biogeochemistry","2011-03-16"
"Future water supply and demand in the Okanagan Basin, British Columbia: a scenario-based analysis of multiple, interacting stressors","Q13442814","Mark Johnson","10.1007/s11269-011-9938-3","Future water supply and demand in the Okanagan Basin, British Columbia: a scenario-based analysis of multiple, interacting stressors","Water Resources Management","2011-11-02"
"Gap‐filling approaches for eddy covariance methane fluxes: A comparison of three machine learning algorithms and a traditional method with principal component analysis","Q13442814","Mark Johnson","10.1111/gcb.14845","Gap‐filling approaches for eddy covariance methane fluxes: A comparison of three machine learning algorithms and a traditional method with principal component analysis","Global Change Biology","2019-09-25"
"Gas Transfer Velocities Evaluated Using Carbon Dioxide as a Tracer Show High Streamflow to Be a Major Driver of Total CO2 Evasion Flux for a Headwater Stream","Q13442814","Mark Johnson","10.1029/2018jg004388","Gas Transfer Velocities Evaluated Using Carbon Dioxide as a Tracer Show High Streamflow to Be a Major Driver of Total CO2 Evasion Flux for a Headwater Stream","Journal of Geophysical Research: Biogeosciences","2018-07-02"
"Groundwater recharge indicator as tool for decision makers to increase socio-hydrological resilience to seasonal drought","Q13442814","Mark Johnson","10.1016/j.jhydrol.2018.05.069","Groundwater recharge indicator as tool for decision makers to increase socio-hydrological resilience to seasonal drought","Journal of Hydrology","2018-05-31"
"High-frequency analysis of dissolved organic carbon storm responses in headwater streams of contrasting forest harvest history","Q13442814","Mark Johnson","10.1016/j.jhydrol.2020.125371","High-frequency analysis of dissolved organic carbon storm responses in headwater streams of contrasting forest harvest history","Journal of Hydrology","2020-08-05"
"Hydrochemistry of shallow groundwater and springs used for potable supply in Southern Brazil","Q13442814","Mark Johnson","10.1007/s12665-018-7254-4","Hydrochemistry of shallow groundwater and springs used for potable supply in Southern Brazil","Environmental Earth Sciences","2018-01-24"
"Hyperspectral and Thermal Sensing of Stomatal Conductance, Transpiration, and Photosynthesis for Soybean and Maize under Drought","Q13442814","Mark Johnson","10.3390/rs12193182","Hyperspectral and Thermal Sensing of Stomatal Conductance, Transpiration, and Photosynthesis for Soybean and Maize under Drought","Remote Sensing","2020-09-29"
"Identifying socio economic levers for a sustainable provision of ecosystem services in Amazonia landscapes","Q13442814","Mark Johnson","10.1088/1755-1307/6/37/372027","Identifying socio economic levers for a sustainable provision of ecosystem services in Amazonia landscapes","IOP Conference Series: Earth and Environmental Science","2009-03-10"
"Impact of different agricultural waste biochars on maize biomass and soil water content in a Brazilian Cerrado Arenosol","Q13442814","Mark Johnson","10.3390/agronomy7030049","Impact of different agricultural waste biochars on maize biomass and soil water content in a Brazilian Cerrado Arenosol","Agronomy","2017-07-20"
"Improving agricultural water use efficiency with biochar–A synthesis of biochar effects on water storage and fluxes across scales","Q13442814","Mark Johnson","10.1016/j.scitotenv.2018.11.312","Improving agricultural water use efficiency with biochar–A synthesis of biochar effects on water storage and fluxes across scales","Science of The Total Environment","2018-11-22"
"Indicativos de descontinuidade litológica de regolitos derivados de granitos em uma microbacia sob floresta Amazônica, em Juruena-MT","Q13442814","Mark Johnson","10.1590/s0100-06832012000200001","Indicativos de descontinuidade litológica de regolitos derivados de granitos em uma microbacia sob floresta Amazônica, em Juruena-MT","Revista Brasileira de Ciência do Solo","2012-06-04"
"Inundation and groundwater dynamics for quantification of evaporative water loss in tropical wetlands","Q13442814","Mark Johnson","10.5194/hess-18-4407-2014","Inundation and groundwater dynamics for quantification of evaporative water loss in tropical wetlands","Hydrology and Earth System Sciences","2014-11-05"
"Investigating the impacts of biochar on water fluxes in tropical agriculture using stable isotopes","Q13442814","Mark Johnson","10.5194/hess-2020-404","Investigating the impacts of biochar on water fluxes in tropical agriculture using stable isotopes","Copernicus GmbH","2020-08-20"
"Isotopic estimation of water balance and groundwater-surface water interactions of tropical wetland lakes in the Pantanal, Brazil","Q13442814","Mark Johnson","10.1080/02626667.2013.870665","Isotopic estimation of water balance and groundwater-surface water interactions of tropical wetland lakes in the Pantanal, Brazil","Hydrological Sciences Journal","2013-12-09"
"Land occupation and transformation impacts of soybean production in Southern Amazonia, Brazil","Q13442814","Mark Johnson","10.1016/j.jclepro.2017.02.120","Land occupation and transformation impacts of soybean production in Southern Amazonia, Brazil","Journal of Cleaner Production","2017-02-17"
"Land use in LCA: including regionally altered precipitation to quantify ecosystem damage","Q13442814","Mark Johnson","10.1021/acs.est.6b02311.s001","Land use in LCA: including regionally altered precipitation to quantify ecosystem damage","American Chemical Society (ACS)","2020-04-07"
"Land-use change and stream water fluxes: Decadal dynamics in watershed nitrate exports","Q13442814","Mark Johnson","10.1007/s10021-007-9091-2","Land-use change and stream water fluxes: Decadal dynamics in watershed nitrate exports","Ecosystems","2007-09-19"
"Land–Water interactions in the amazon","Q13442814","Mark Johnson","10.1007/s10533-011-9622-y","Land–Water interactions in the amazon","Biogeochemistry","2011-07-27"
"Life Cycle Assessment of Greenhouse Gas Emissions from Dairy Production in a Central New York State Watershed","Q13442814","Mark Johnson","10.35648/20.500.12413/11781/ii250","Life Cycle Assessment of Greenhouse Gas Emissions from Dairy Production in a Central New York State Watershed","Taiwan Water Conservancy Journal","2020-05-31"
"Litterfall production and fluvial export in headwater catchments of the southern Amazon","Q13442814","Mark Johnson","10.1017/s0266467406003956","Litterfall production and fluvial export in headwater catchments of the southern Amazon","Journal of Tropical Ecology","2007-04-24"
"Mapping soil organic carbon and clay using remote sensing to predict soil workability for enhanced climate change adaptation","Q13442814","Mark Johnson","10.1016/j.geoderma.2020.114177","Mapping soil organic carbon and clay using remote sensing to predict soil workability for enhanced climate change adaptation","Geoderma","2020-01-16"
"Measurements of Greenhouse Gas Exchange over a Conventionally Managed Highbush Blueberry Field in the Fraser River Delta in BC, Canada","Q13442814","Mark Johnson","10.1016/j.agrformet.2020.108152","Measurements of Greenhouse Gas Exchange over a Conventionally Managed Highbush Blueberry Field in the Fraser River Delta in BC, Canada","Agricultural and Forest Meteorology","2020-09-08"
"Modeling to discern nitrogen fertilization impacts on carbon sequestration in a Pacific Northwest Douglas‐fir forest in the first‐postfertilization year","Q13442814","Mark Johnson","10.1111/j.1365-2486.2010.02298.x","Modeling to discern nitrogen fertilization impacts on carbon sequestration in a Pacific Northwest Douglas‐fir forest in the first‐postfertilization year","Global Change Biology","2010-07-23"
"Monitoramento contínuo do potencial redox e de variáveis complementares em ambiente hipersazonal no pantanal norte","Q13442814","Mark Johnson","10.1590/s0100-06832013000300009","Monitoramento contínuo do potencial redox e de variáveis complementares em ambiente hipersazonal no pantanal norte","Revista Brasileira de Ciência do Solo","2013-07-21"
"Net ecosystem carbon balance of a peat bog undergoing restoration: integrating CO2 and CH4 fluxes from eddy covariance and aquatic evasion with DOC drainage fluxes","Q13442814","Mark Johnson","10.1029/2019jg005123","Net ecosystem carbon balance of a peat bog undergoing restoration: integrating CO2 and CH4 fluxes from eddy covariance and aquatic evasion with DOC drainage fluxes","Journal of Geophysical Research: Biogeosciences","2019-03-19"
"Nitrogen aboveground turnover and soil stocks to 8 m depth in primary and selectively logged forest in southern Amazonia","Q13442814","Mark Johnson","10.1111/j.1365-2486.2009.02068.x","Nitrogen aboveground turnover and soil stocks to 8 m depth in primary and selectively logged forest in southern Amazonia","Global Change Biology","2009-09-15"
"Nitrogen enrichment potential of biochar in relation to pyrolysis temperature and feedstock quality","Q13442814","Mark Johnson","10.1016/j.jenvman.2015.01.021","Nitrogen enrichment potential of biochar in relation to pyrolysis temperature and feedstock quality","Journal of Environmental Management","2015-01-23"
"Organic carbon fluxes within and streamwater exports from headwater catchments in the southern Amazon","Q13442814","Mark Johnson","10.1002/hyp.6218","Organic carbon fluxes within and streamwater exports from headwater catchments in the southern Amazon","Hydrological Processes","2006-07-24"
"PS 44-82: Training tomorrow's environmental problem-solvers: An integrative approach to graduate education","Q13442814","Mark Johnson","10.1525/bio.2009.59.6.10","PS 44-82: Training tomorrow's environmental problem-solvers: An integrative approach to graduate education","BioScience","2009-06-02"
"Physiological responses to extreme hydrological events in the Pantanal wetland: heterogeneity of a plant community containing super‐dominant species","Q13442814","Mark Johnson","10.1111/jvs.12379","Physiological responses to extreme hydrological events in the Pantanal wetland: heterogeneity of a plant community containing super‐dominant species","Journal of Vegetation Science","2016-01-11"
"Public participation and perceptions of watershed modeling","Q13442814","Mark Johnson","10.1080/08941920802220347","Public participation and perceptions of watershed modeling","Society & Natural Resources","2008-12-19"
"Radiative forcing of methane fluxes offsets net carbon dioxide uptake for a tropical flooded forest","Q13442814","Mark Johnson","10.1111/gcb.14615","Radiative forcing of methane fluxes offsets net carbon dioxide uptake for a tropical flooded forest","Global Change Biology","2019-03-11"
"Rain-fed and irrigated cropland-atmosphere water fluxes and their implications for agricultural production in Southern Amazonia","Q13442814","Mark Johnson","10.1016/j.agrformet.2018.03.023","Rain-fed and irrigated cropland-atmosphere water fluxes and their implications for agricultural production in Southern Amazonia","Agricultural and Forest Meteorology","2018-04-09"
"Relationships between soil hydrology and forest structure and composition in the southern Brazilian Amazon","Q13442814","Mark Johnson","10.1111/j.1654-1103.2007.tb02529.x","Relationships between soil hydrology and forest structure and composition in the southern Brazilian Amazon","Journal of Vegetation Science","2009-02-24"
"Relative humidity gradients as a key constraint on terrestrial water and energy fluxes","Q13442814","Mark Johnson","10.31223/x59880","Relative humidity gradients as a key constraint on terrestrial water and energy fluxes","California Digital Library (CDL)","2020-12-01"
"Runoff sources and land cover change in the Amazon: an end-member mixing analysis from small watersheds","Q13442814","Mark Johnson","10.1007/s10533-011-9597-8","Runoff sources and land cover change in the Amazon: an end-member mixing analysis from small watersheds","Biogeochemistry","2011-04-02"
"Simultaneous Measurements of Soil CO2 and CH4 Fluxes Using Laser Absorption Spectroscopy","Q13442814","Mark Johnson","10.2134/ael2015.12.0014","Simultaneous Measurements of Soil CO2 and CH4 Fluxes Using Laser Absorption Spectroscopy","Agricultural & Environmental Letters","2016-09-28"
"Soil CO 2 Dynamics in a Tree Island Soil of the Pantanal: The Role of Soil Water Potential","Q13442814","Mark Johnson","10.1371/journal.pone.0064874","Soil CO 2 Dynamics in a Tree Island Soil of the Pantanal: The Role of Soil Water Potential","PLoS ONE","2013-06-10"
"Soil CO2 concentrations and efflux dynamics of a tree island in the Pantanal wetland","Q13442814","Mark Johnson","10.1002/2017jg003877","Soil CO2 concentrations and efflux dynamics of a tree island in the Pantanal wetland","Journal of Geophysical Research: Biogeosciences","2017-08-14"
"Spatial and temporal variability of soil water repellency of Amazonian pastures","Q13442814","Mark Johnson","10.1071/sr04097","Spatial and temporal variability of soil water repellency of Amazonian pastures","Soil Research","2005-05-27"
"Spatial patterns of DOC concentration and DOM optical properties in a Brazilian tropical river‐wetland system","Q13442814","Mark Johnson","10.1002/2017jg003797","Spatial patterns of DOC concentration and DOM optical properties in a Brazilian tropical river‐wetland system","Journal of Geophysical Research: Biogeosciences","2017-07-15"
