"Spectral entropy as a mean to quantify water stress history for natural vegetation and irrigated agriculture in a water-stressed tropical environment","Q13442814","Mark Johnson","10.1002/essoar.95a79bd46e3a0342.6bebb835b5a94839.1","Spectral entropy as a mean to quantify water stress history for natural vegetation and irrigated agriculture in a water-stressed tropical environment","Wiley","2019-11-13"
"Storm pulses of dissolved CO2 in a forested headwater Amazonian stream explored using hydrograph separation","Q13442814","Mark Johnson","10.1029/2007wr006359","Storm pulses of dissolved CO2 in a forested headwater Amazonian stream explored using hydrograph separation","Water Resources Research","2007-11-14"
"Stream Discharge in Tropical Headwater Catchments as a Result of Forest Clearing and Soil Degradation","Q13442814","Mark Johnson","10.1175/2012ei000439.1","Stream Discharge in Tropical Headwater Catchments as a Result of Forest Clearing and Soil Degradation","Earth Interactions","2012-08-10"
"Stream water nutrient and organic carbon exports from tropical headwater catchments at a soil degradation gradient","Q13442814","Mark Johnson","10.1007/s10705-013-9554-0","Stream water nutrient and organic carbon exports from tropical headwater catchments at a soil degradation gradient","Nutrient Cycling in Agroecosystems","2013-01-30"
"Streams with Riparian Forest Buffers versus Impoundments Differ in Discharge and DOM Characteristics for Pasture Catchments in Southern Amazonia","Q13442814","Mark Johnson","10.3390/w11020390","Streams with Riparian Forest Buffers versus Impoundments Differ in Discharge and DOM Characteristics for Pasture Catchments in Southern Amazonia","Water","2019-02-25"
"Submersible UV-Vis spectroscopy for quantifying streamwater organic carbon dynamics: Implementation and challenges before and after forest harvest in a headwater stream","Q13442814","Mark Johnson","10.3390/s120403798","Submersible UV-Vis spectroscopy for quantifying streamwater organic carbon dynamics: Implementation and challenges before and after forest harvest in a headwater stream","Sensors","2012-03-24"
"Summertime greenhouse gas fluxes from an urban bog undergoing restoration through rewetting.","Q13442814","Mark Johnson","10.5194/bg-14-2799-2017","Summertime greenhouse gas fluxes from an urban bog undergoing restoration through rewetting.","Biogeosciences","2017-06-08"
"Temporal dynamics of soil CO2 efflux in the Northern Pantanal of Mato Grosso, Brazil","Q13442814","Mark Johnson","10.1080/03680770.1995.11900941","Temporal dynamics of soil CO2 efflux in the Northern Pantanal of Mato Grosso, Brazil","SIL Proceedings, 1922-2010","2017-12-01"
"Temporal variability of nitrous oxide from fertilized croplands: hot moment analysis","Q13442814","Mark Johnson","10.2136/sssaj2012.0039","Temporal variability of nitrous oxide from fertilized croplands: hot moment analysis","Soil Science Society of America Journal","2012-09-12"
"The role of rivers in the regional carbon balance","Q13442814","Mark Johnson","10.1029/2008gm000734","The role of rivers in the regional carbon balance","Amazonia and Global Change","2011-09-09"
"Tracking changes in soil organic carbon across the heterogeneous agricultural landscape of the Lower Fraser Valley of British Columbia","Q13442814","Mark Johnson","10.1016/j.scitotenv.2020.138994","Tracking changes in soil organic carbon across the heterogeneous agricultural landscape of the Lower Fraser Valley of British Columbia","Science of The Total Environment","2020-05-05"
"Transcatheter Valve-in-Valve Implantation for Failed Bioprosthetic Heart Valves","Q13442814","Mark Johnson","10.1161/circulationaha.109.924613","Transcatheter Valve-in-Valve Implantation for Failed Bioprosthetic Heart Valves","Circulation","2010-04-13"
"Variabilidade espacial de atributos físicos de solo usada na identificação de classes pedológicas de microbacias na Amazônia meridional","Q13442814","Mark Johnson","10.1590/s0100-06832007000100010","Variabilidade espacial de atributos físicos de solo usada na identificação de classes pedológicas de microbacias na Amazônia meridional","Revista Brasileira de Ciência do Solo","2007-10-04"
"Variação Sazonal do Carbono Orgânico Dissolvido (COD) e Propriedades Ópticas da Matéria Orgânica em Diferentes Sistemas de Pastagem e de Soja no Estado de Mato Grosso","Q13442814","Mark Johnson","10.5902/2179460x27649","Variação Sazonal do Carbono Orgânico Dissolvido (COD) e Propriedades Ópticas da Matéria Orgânica em Diferentes Sistemas de Pastagem e de Soja no Estado de Mato Grosso","Ciência e Natura","2017-11-20"
"Water quality and greenhouse gas fluxes for stormwater detained in a constructed wetland","Q13442814","Mark Johnson","10.1016/j.jenvman.2018.10.106","Water quality and greenhouse gas fluxes for stormwater detained in a constructed wetland","Journal of Environmental Management","2018-11-17"
"Water use by terrestrial ecosystems: temporal variability in rainforest and agricultural contributions to evapotranspiration in Mato Grosso, Brazil","Q13442814","Mark Johnson","10.1088/1748-9326/7/2/024024","Water use by terrestrial ecosystems: temporal variability in rainforest and agricultural contributions to evapotranspiration in Mato Grosso, Brazil","Environmental Research Letters","2012-06-25"
"Water use dynamics in double cropping of rainfed upland rice and irrigated melons produced under drought‐prone tropical conditions","Q13442814","Mark Johnson","10.1029/2018wr023757","Water use dynamics in double cropping of rainfed upland rice and irrigated melons produced under drought‐prone tropical conditions","Water Resources Research","2019-04-18"
"Watershed services in the humid tropics: Opportunities from recent advances in ecohydrology","Q13442814","Mark Johnson","10.1002/eco.1921","Watershed services in the humid tropics: Opportunities from recent advances in ecohydrology","Ecohydrology","2017-11-04"
